"rank","artist","title","releaseYear","listHighestRank","listType","x","y"
"3","无描述","袁隆平去世","2021-05-22","1","2021-05-22","887.85","160.88"
"2","2021创造营全新的男团诞生，来腾讯视频成团夜和大家一同见证！世界那么大，我们一起闯！","创造营成团名单","2021-04-24","2","2021-04-24","930.5","265.54"
"3",,"外交部","2021-01-19","3","2021-01-19","784.02","145.53"
"4","23日，赵丽颖冯绍峰官宣离婚，表示未来会共同抚养孩子。","赵丽颖冯绍峰离婚","2021-04-23","4","2021-04-23","859.17","281.43"
"5","今日中央政法委新闻网站官方微博发文评论称：作为中国公民，因为代孕在中国被禁止，就钻法律空子就跑去美国，这绝不是遵纪守法。","中央政法委评郑爽代孕弃养","2021-01-19","5","2021-01-19","815.22","302.71"
"6","综艺  ","张小斐毛衣","2021-02-11","6","2021-02-11","1431.7","196.4"
"7","@赵丽颖工作室 发声明称部分用户近日散布了关于赵丽颖的谣言。对于极其恶劣、严重伤害赵丽颖及其家人的不实言论以及涉嫌侵犯其名誉权的行为，坚决“零容忍”。","赵丽颖工作室声明","2021-01-22","7","2021-01-22","935.93","374.92"
"8","近日，郑爽爸爸接受采访正式道歉，称作为一个家长没有正确的引导孩子。","郑爽爸爸道歉","2021-01-23","8","2021-01-23","1771.79","307.04"
"9","今天，杨丞琳在微博发文“见面了”，表示自己终于和李荣浩见到面了。","杨丞琳李荣浩终于见面了","2021-01-23","9","2021-01-23","889.49","342.36"
"10","旅游  ","昆明","2021-01-22","10","2021-01-22","1281.8","312.12"
"11","天津公安机关对一名针对袁隆平院士逝世在网上发表侮辱性言论的男子采取刑事强制措施。英雄不容亵渎！ ​","男子侮辱袁老被采取刑事强制措施","2021-05-22","11","2021-05-22","1630.78","267.28"
"12","马可发微博宣布结婚：“谢谢大家的关心，两年多的家庭生活，在爱与被爱中学会责任、体会幸福，感谢生活让我成长。 ​​​”","马可宣布结婚","2021-01-28","12","2021-01-28","785.42","357.28"
"13","张雨剑发文承认已经结婚，但表示不应该拍小孩还把小孩名字曝光出来。","张雨剑承认有女儿","2021-03-15","13","2021-03-15","1106.33","316.26"
"14","中国女足与韩国女足奥预赛第二回合比赛结束，中国队在落后两球的情况下，凭借王霜的梅开二度，通过加时赛，总比分4-3战胜对手，昂首晋级东京奥运会！","中国女足晋级东京奥运会","2021-04-13","14","2021-04-13","1040.88","315.32"
"15",,"代孕","2021-01-18","15","2021-01-18","1324.26","345.69"
"16","疑似郑爽和张恒的孩子出生证明曝光，男孩是2019年12月19日在科罗拉多州出生，女孩是2020年1月4日在内华达州出生。","郑爽张恒孩子出生证明","2021-01-18","16","2021-01-18","999.25","144.47"
"17","明星  ","恭喜佟丽娅","2021-05-20","17","2021-05-20","1320.26","202.68"
"18","一位刚刚毕业的姑娘说，今年能以幸福的心情看春晚，已然不易，“希望明年比今年更好”。","女孩提到去年春节哽咽了","2021-02-11","18","2021-02-11","639.6","209.81"
"19","4月24日，黑龙江密山，被进村东北虎扑倒女子已手术结束。密山市人民医院护士说，该女子昨天做的手术，现在是术后第一天，主要肌肉损伤，目前状态良好、意识清醒。23日，一只成年东北虎闯进黑龙江村庄，扑倒正在田间工作的一名女子，随后路过村民将其救下送往医院救治。","被进村东北虎扑倒女子手术结束","2021-04-24","19","2021-04-24","1148.18","143.03"
"20","无描述","FILA中国退出BCI","2021-03-25","20","2021-03-25","894.28","396.72"
"21","社会  ","警方通报成都四十九中学生坠亡","2021-05-11","21","2021-05-11","1249.54","161.9"
"22","一位做过肛拭子采样女士接受采访时表示，自己做肛拭子采样全程约10秒，一次做两遍。专家表示，目前肛拭子采集只针对重点人群，是为提高检出率，减少漏诊。","肛拭子受采者讲述采样过程","2021-01-23","22","2021-01-23","835.71","195.25"
"23","明星  ","张鹤伦发文","2021-02-10","23","2021-02-10","644.83","340.57"
"24","明星  ","陈翔","2021-01-29","24","2021-01-29","1799.63","185.75"
"25","明星  ","金晨求网友删博","2021-02-07","25","2021-02-07","1366.95","294.01"
"26","资深演员廖启智3月28日晚因胃癌去世，享年66岁。","廖启智去世","2021-03-28","26","2021-03-28","973.24","173.41"
"27","社会  ","赵立坚连说3遍中国没有种族灭绝","2021-01-28","27","2021-01-28","947.75","122.44"
"28","综艺  ","开心麻花央视春晚节目被毙","2021-02-01","28","2021-02-01","1582","243.23"
"29",,"周迅躺着玩手机鼻梁被砸伤","2021-01-30","29","2021-01-30","1110.69","193.71"
"30","无描述","利路修翻白眼","2021-04-24","30","2021-04-24","1066.38","365.37"
"31","鹿晗今晚的直播截图来了，你觉得鹿晗的颜值状态怎么样？","鹿晗状态","2021-03-16","31","2021-03-16","1324.04","152.33"
"32","无描述","李莎旻子 我恋爱了","2021-05-07","32","2021-05-07","1287.86","182.86"
"33",,"首都航空JD5166航班","2021-01-24","33","2021-01-24","1724.37","313.5"
"34","96年出生的女孩洛洛在杭州工作三年，由于长期疑遭受家里的索取，心理压力很大。在2019年十月份，心情不好和男友吵架，去钱塘江散心，遇到涨潮意外去世。事后公司对家属补偿了6万元，但三天后其父母突然索赔41万，原因是要给弟弟买房子？","现实版樊胜美","2021-01-26","34","2021-01-26","1724.4","165.94"
"35","今天上海市第二中级人民法院对郑爽张恒民间借贷纠纷案进行了听证， 周俊表示，外界所传言的张恒以郑爽名义向外界高利贷是子虚乌有的。张恒方诉求是，将一审判决发回重审或改判。","张恒代理律师发声","2021-01-19","35","2021-01-19","1268.22","375.99"
"36","日政府不认为中国在新疆实施种族灭绝，赵立坚：绝大多数国家眼睛是雪亮的","日政府不认为中国在新疆实施种族灭绝","2021-01-27","36","2021-01-27","1576.01","179.94"
"37","《萌探探探案》太好笑，那英把杨紫拍飞了，太好笑了！","那英三巴掌拍飞杨紫","2021-05-28","37","2021-05-28","1065.89","217.75"
"38","明星  ","薛之谦","2021-02-03","38","2021-02-03","731.04","342.49"
"39","@马思纯 在本期#吐槽大会#上回应了自己被吐槽变胖的事情，说自己在拍摄《断桥》和《左耳》时，为了塑造角色七天瘦十斤、二十天瘦二十斤。","马思纯回应自己胖了","2021-03-14","39","2021-03-14","694.87","230.36"
"40","肖战提裙子后续来了，上台接受微博King荣誉时终于帮杨紫提到了裙摆！","肖战终于提到了杨紫的裙摆","2021-02-28","40","2021-02-28","1014.99","341.95"
"41","社会  ","第二只豹子已被狗咬死","2021-05-08","41","2021-05-08","1550.99","273.56"
"42","圆梦火星征途，海澜之家与你一起见证中国航天骄傲时刻！","天问一号登陆火星","2021-05-15","42","2021-05-15","1601.06","215.32"
"43","披着所谓“正义”外衣，却行不义勾当，H&M的声明何其伪善；在中国赚个盆满钵溢，却中伤中国、肆意栽赃，这种企业毫无基本商业伦理，逾越底线。","央视评HM抵制新疆棉花","2021-03-24","43","2021-03-24","946.59","415.46"
"44","文咏珊点赞了angelababy否认插足黄晓明李菲儿的文章，两人曾是亲密好友，后关系疏远。","文咏珊点赞Angelababy","2021-01-06","44","2021-01-06","1339.23","274.67"
"45","互联网  ","微信bug","2021-01-19","45","2021-01-19","1652.63","300.72"
"46",,"章子怡 我老公不仅出歌而且产瓜","2021-01-31","46","2021-01-31","774.09","405.02"
"47","借精心雕琢的“强迫劳动”概念“以疆制华”，详戳↓↓","BCI总部对华强硬内幕","2021-03-28","47","2021-03-28","1772.38","166.04"
"48","无描述","张恒被判归还借款2000万","2021-03-31","48","2021-03-31","862.15","103.82"
"49","张靓颖表示赵英俊是吃完止疼药在家录的《送你一朵小红花》，那之后她每次聊天的结尾都发小红花的表情给英俊。","赵英俊吃完止疼药在家录的小红花","2021-02-03","49","2021-02-03","1147.9","249.94"
"50","王迅: 你这脖子上顶的是个啥黄子韬: 一张英俊潇洒的脸[哈哈]帅哥你说的对！","黄子韬脖子上是一张英俊潇洒的脸","2021-02-11","50","2021-02-11","1314.02","122.06"
"51","社会  ","吴孟超逝世","2021-05-22","51","2021-05-22","1214.15","361.78"
"52","中美举行高层战略对话，第一场会议上，国务委员兼外长王毅发言时美方代表在传纸条。看↓","王毅发言时美方代表在传纸条","2021-03-19","52","2021-03-19","759.46","293.85"
"53","无描述","虞书欣加上了Lisa微信","2021-02-18","53","2021-02-18","1060.58","133.49"
"54","无描述","鹿晗 酒吧","2021-04-30","54","2021-04-30","1042.32","386.09"
"55","浙江省嘉善县公安局发布警情通报：3月13日，魏塘街道发生一起重大刑事案件，致5人死亡，1人受伤。","浙江发生重大刑案致5死","2021-03-13","55","2021-03-13","851.7","151.44"
"56","社会  ","健康码出自一名杭州民警","2021-01-09","56","2021-01-09","697.77","341.23"
"57","杭州林女士（化名）在刷剧时发现电视剧的取景地竟是自己位于宁波、一直空置的别墅，随后将电视剧出品方、物业公司、播放平台等诉至法院，要求赔偿近300万元。日前，宁波慈溪市法院作出一审判决：判令两部电视剧的出品方赔偿林女士财产损失、房屋占有费等40余万元。","电视剧女主睡在我家床案一审判决","2021-03-03","57","2021-03-03","1843.98","188.32"
"58","无描述","沈腾追Angelababy时摔倒","2021-04-02","58","2021-04-02","910.61","105.83"
"59","襄阳一位阿姨晒贾玲妈妈年轻时的照片，贾玲妈妈真好看呀～","贾玲妈妈年轻时的照片","2021-02-16","59","2021-02-16","1192.02","277.86"
"60","无描述","甘肃山地马拉松16名参赛选手遇难","2021-05-23","60","2021-05-23","838.96","374.19"
"61","半藏森林广告风波后发长文，称她任何举动都会掀起一场道德审判的盛宴，自己所承受的“私刑”已经越过了普世价值下的道德底线。","半藏森林发长文","2021-01-17","61","2021-01-17","653.38","288.27"
"62","自2021年1月17日起，将石家庄新乐市长寿街道调整为高风险地区。","石家庄新乐市长寿街道升为高风险","2021-01-17","62","2021-01-17","1293.45","392.9"
"63","1998年，孙小果曾因强奸罪、故意伤害罪等多项罪名被判死刑，却只服刑12年零5个月就被释放。2020年2月20日，孙小果被执行死刑！","孙小果被执行死刑前画面公开","2021-03-30","63","2021-03-30","1457.22","239.42"
"64","电商  ","清空购物车","2021-02-11","64","2021-02-11","879.4","249.03"
"65","社会  ","500余名艺人发声反对短视频侵权","2021-04-25","65","2021-04-25","1000.04","384.76"
"66","张碧晨在猜歌环节猜的是《斗牛》，画画环节则是花了一朵花","张碧晨猜歌猜了斗牛","2021-02-13","66","2021-02-13","992.69","93.37"
"67","无描述","王子文 说姐苦恋六年那会姐有男朋友","2021-03-28","67","2021-03-28","1067.93","396.2"
"68","7日，Angelababy否认插足黄晓明和李菲儿后首现身，一身黑色亮片西装深V内搭，状态不错。她与蔡徐坤同台，画面养眼。","Angelababy蔡徐坤同框","2021-01-07","68","2021-01-07","755.04","107.85"
"69","“我男朋友马伯骞，我叫他大伯”，辣目洋子这是什么脑回路哈哈。","我男朋友马伯骞 我叫他大伯","2021-02-12","69","2021-02-12","716.99","305.8"
"70",,"你好李焕英票房破10亿","2021-02-14","70","2021-02-14","1303.88","275.16"
"71","税务和广电管理部门将严查违法违规行为，坚决查处整治“阴阳合同”、“天价片酬”、偷逃税等问题。","郑爽涉嫌签订阴阳合同被调查","2021-04-28","71","2021-04-28","598.22","246.99"
"72","关晓彤工作室发文否认视频假吃，并且晒出视频力证，表示是因为视频时长问题。","关晓彤工作室否认吃播假吃","2021-05-19","72","2021-05-19","1902.14","235.43"
"73","中国视协：依法纳税是宪法规定的每个公民的基本义务和爱国守法的道德义务。对于没有艺德的艺人，社会决不会为其提供发声露脸的机会。","中国视协回应郑爽被查","2021-04-29","73","2021-04-29","968.55","308.96"
"74","邢台市委常委、宣传部部长戎阳说，据隆尧县报告，因检测能力有限，收集样本委托济南某单位承担。14日，该公司向卫健部门谎报全部阴性。16日上午又报告有阳性样本。","第三方机构谎报全员阴性结果","2021-01-17","74","2021-01-17","1461.33","174.6"
"75","张加丽女士在《希望的田野》成推荐会主持人，刚刚杨迪用实际行动支持丽丽子solo出道。","杨迪申请当妈妈超话主持人","2021-01-17","75","2021-01-17","1342.12","235.95"
"76","人民日报四问通化物资配送问题，回应如下：①目前通化市粮油菜肉蛋奶等基本生活物资储备充足，不存在短缺现象；②通化装配蔬菜包以成本价直送家中；③通化计划组织7000多人为封闭小区配送物资；④通化市民可携近期2次核酸结果阴性证明，报名当志愿者。","人民日报四问通化物资配送问题","2021-01-24","76","2021-01-24","1653.2","195.7"
"77","社会  ","赖小民被执行死刑","2021-01-29","77","2021-01-29","1081.24","256.46"
"78","无描述","鹿晗一到薇娅直播间就变吃播","2021-03-02","78","2021-03-02","838.24","400.63"
"79","哈尔滨呼兰公安通报社区志愿者被捅身亡，目前嫌犯已被刑事拘留","警方通报社区志愿者被捅身亡","2021-02-03","79","2021-02-03","949.78","91.77"
"80","网传一段关于“西藏冒险王20次降噪视频”引发热议。王相军的弟弟王龙称，网传视频是其哥哥王相军2020年12月10日拍摄的，相当于12月19日当天发的是此前拍摄的库存视频，哥哥是12月20日遇难的，时间节点对不上。“那个地方确实不可能是案发现场。”","西藏冒险王弟弟回应网传降噪视频","2021-01-22","80","2021-01-22","1296.33","366.84"
"81","音乐-华语音乐  ","蔡徐坤 不好意思又是我","2021-01-23","81","2021-01-23","1106.31","253.96"
"82",,"潘博文","2021-01-17","82","2021-01-17","1862.44","311.82"
"83","BCI上海办事处一名员工回应，BCI中国团队没有在新疆发现强迫劳动，品牌行为与其无关，今日将发表最新声明。","BCI上海办事处回应","2021-03-25","83","2021-03-25","1318.41","378.52"
"84","近日，《快乐大本营》导演甘亿在采访中回应“快本现在谁红谁上，以前谁上谁红”的争议，称根本原因在于现在网络的曝光力量是最强大的。","快本导演回应谁红谁上节目的争议","2021-05-21","84","2021-05-21","1699.34","328.92"
"85","路透社今日消息，加拿大一家法院13日庭审时曝出，华为首席财务官孟晚舟在温哥华居家期间，曾数次收到死亡威胁，其中包括装有子弹的信件。","孟晚舟在温哥华多次收到死亡威胁","2021-01-14","85","2021-01-14","1443.26","343.29"
"86","华晨宇、关晓彤合作演绎《我的少女时代——十年之约》。","华晨宇关晓彤演我的少女时代","2021-02-19","86","2021-02-19","1170.29","216.69"
"87","明星-内地  ","周杰伦胖了","2021-01-17","87","2021-01-17","1042.79","172.37"
"88","港媒报道称吴孟达今日病情情况转危，已经转入ICU治疗，医生通知家人到医院来看他，好友田启文也赶去了医院。","吴孟达病情加重转入ICU","2021-02-27","88","2021-02-27","1691.39","257.04"
"89","一名与华盛顿关系密切的工党高级官员爆料，梅根利用奥普拉采访风波来开启她的政治生涯，并正在与美国民主党高层建立联系并成立竞选与筹款团队。","梅根或准备竞选美国总统","2021-03-14","89","2021-03-14","1675.6","206.87"
"90","社会  ","印度疫情","2021-04-24","90","2021-04-24","967.7","224.4"
"91","2月2日，女演员高溜微博发长文，讲述了自己做医美鼻子整形失败的不幸遭遇。","演员高溜整容失败鼻尖坏死","2021-02-03","91","2021-02-03","1373.14","330.48"
"92","有网友称在陈赫火锅店就餐时被掉落的天花板砸伤，陈赫转发火锅店声明道歉，“再次向两位顾客深表歉意，全面排查整改，安全问题绝不姑息！” ​","陈赫道歉","2021-04-11","92","2021-04-11","1291.91","136.49"
"93","无描述","易烊千玺上海迪士尼","2021-05-20","93","2021-05-20","1359.71","352.66"
"94","《我就是演员》宋妍霏说自己一年多没接到戏了，曾被说长得太有攻击性了。","宋妍霏被说长得有攻击性","2021-01-09","94","2021-01-09","1026.88","127.57"
"95","微信今日更新8.0版本，新表情来了，常用的黄脸表情包比如裂开、让我看看等都可以动起来了。微信方面表示正在灰度测试新表情中，看看你的黄脸表情会动了吗？","微信黄脸表情会动了","2021-01-21","95","2021-01-21","937.32","184.24"
"96","4月17日，@郑恺 在生日会上透露不出意外的话，今年将和@苗苗-vivi 办婚礼。","郑恺今年办婚礼","2021-04-17","96","2021-04-17","696.95","370.29"
"97","唐嫣在《王牌对王牌》中再次扮演紫萱，回忆满满呀！！","唐嫣再扮紫萱","2021-02-26","97","2021-02-26","617.14","180.95"
"98",,"杨幂玩的是张飞","2021-01-24","98","2021-01-24","1229.91","311.38"
"99","上海迪士尼噗噗熊被打🐻小孩冲过来打，事后家长态度也十分强硬！","上海迪士尼噗噗熊被打","2021-05-06","99","2021-05-06","723.78","219.36"
"100","今年春节档黑马《你好，李焕英》，票房正蹭蹭往上涨，目前总票房已破36.51亿，超越《红海行动》的36.5095亿票房，目前位列中国影史票房第六名。","你好李焕英位列中国影史票房第六名","2021-02-20","100","2021-02-20","863.29","400"
"101","追光吧哥哥中杜淳的最新顶胯舞，你们看完后是什么反应？？","杜淳顶胯","2021-01-23","101","2021-01-23","1752.91","188.77"
"102","#80后90后的压力有多大#有人问我，如果看待有些80后90后不生小孩子呀，是不喜欢吗？","80后90后的压力有多大","2021-01-17","102","2021-01-17","1219.53","199.9"
"103","明星-内地  ","baby在上海时会每天送小海绵上学","2021-04-07","103","2021-04-07","834.78","105.66"
"104","其他  ","袁隆平","2021-05-22","104","2021-05-22","728.45","124.76"
"105","无描述","华晨宇发色","2021-05-03","105","2021-05-03","1395.91","286.87"
"106","R1SE成员任豪发文谈日本福岛核废水引争议，他删博后再发文回应，“如果你的冷嘲热讽能唤起大家的重视，那我觉得骂骂我也还挺开心的”。","任豪回应","2021-04-14","106","2021-04-14","724.84","270.68"
"107","1月14日0—24时,河北新增90例本土确诊病例。","河北新增90例本土确诊","2021-01-15","107","2021-01-15","1151.77","358.11"
"108","货拉拉女乘客身亡，事发半个月后，22日，长沙警方对事发现场进行重新勘查。法医刘良认为，女孩跳窗的可能性不大。","法医称货拉拉跟车女孩跳窗可能性不大","2021-02-25","108","2021-02-25","909.56","80.68"
"109","薛之谦发长文悼念赵英俊：“16年前，不管从外观还是口音，我想我们都不会是朋友。16年后，我最难过的事，竟然是送走了你。……再见了哥，希望不久就会下雨……” ​","薛之谦悼念赵英俊","2021-02-05","109","2021-02-05","1166.55","322.97"
"110","据多位业内人士消息，原乐视影业CEO及执行董事张昭去世，终年58岁。","张昭去世","2021-02-03","110","2021-02-03","693.47","132.26"
"111","电视剧  ","陈紫函主持温客行周子舒大婚","2021-03-29","111","2021-03-29","1511.3","159.86"
"112","综艺  ","天天向上","2021-01-17","112","2021-01-17","1187.81","343.32"
"113","乐华娱乐发布声明，对网传王一博约会开红跑车的网红等言论进行辟谣，称相关言论皆为不实，已委托律所进行取证，将严肃追责。 ​","王一博方声明","2021-01-11","113","2021-01-11","749.04","195.06"
"114","无描述","周星驰 我还无法接受","2021-02-27","114","2021-02-27","1499.18","326"
"115","据@企查查 ，阿迪达斯体育（中国）有限公司于4月23日新增行政处罚，处罚机关为苏州工业园区市场监督管理局，处罚事由为违反广告内容管理规定行为及其从属。","阿迪达斯被罚","2021-05-12","115","2021-05-12","1101.57","145.5"
"116","近日，江苏邳州的宋某向法院起诉，要求撤销婚姻。此前，宋某和妻子办理结婚登记手续后，才得知妻子患有偏执型精神分裂症，且有家族病史。","婚前隐瞒精神病史法院支持撤销婚姻","2021-03-31","116","2021-03-31","1285.97","345.44"
"117","明星  ","王子文吴永恩牵手走红毯","2021-04-12","117","2021-04-12","1808.73","256.28"
"118","26日，邓超、陈赫、鹿晗在微博晒出三人合照，邓超、鹿晗调侃陈赫的脚全世界最丑。","邓超鹿晗说陈赫的脚全世界最丑","2021-05-26","118","2021-05-26","975.32","345.68"
"119","明星-内地  ","李佳航发文呼吁互相理解","2021-05-08","119","2021-05-08","680.93","164.86"
"120","张震为《缉魂》减重25斤，超标完成导演期待。“这种极致的减肥，痛苦是一定很痛苦的。”","张震为缉魂减重25斤","2021-01-17","120","2021-01-17","1854.13","253.58"
"121","沈月微博直播太好玩了，和刘以豪闫桉代云帆连麦，居然都插不上嘴，听三个男生讲发色哈哈哈","沈月直播插不上嘴","2021-05-16","121","2021-05-16","817.48","132.13"
"122","无描述","撒贝宁催婚李佳琦金靖","2021-05-10","122","2021-05-10","697.94","260.28"
"123","无描述","鹿晗 化妆不分性别","2021-05-09","123","2021-05-09","1089.44","124.78"
"124","综艺-内地综艺  ","周也孟子义开口能把人送走","2021-05-29","124","2021-05-29","728.09","158.23"
"125",,"傅首尔 真实的自卑好过虚假的自信","2021-02-04","125","2021-02-04","1855.09","346.37"
"126","财经  ","斯凯奇声明中国供应商没有强制劳工","2021-03-26","126","2021-03-26","969.87","103.8"
"127","工作室否认网传黄晓明逛夜店并有美女陪同，称2月4日起黄晓明已进组拍摄，大年三十回老家初一即刻返工，不存在现身夜店。","黄晓明工作室声明","2021-02-17","127","2021-02-17","1144.53","396.59"
"128","全国人大代表李甦雁建议，创新教育评价机制，把包括视力状况在内的学生体质健康状况纳入衡量学生综合素质的标准，作为评价地方和学校工作的重要依据，“切莫牺牲孩子的视力来换取高分数和好成绩”。","建议把视力纳入学生综合素质考核","2021-03-05","128","2021-03-05","1732.03","211.67"
"129","明星  ","高天佐道歉","2021-01-08","129","2021-01-08","1247.31","129.11"
"130","5月22日，突如其来的恶劣天气让五名越野赛选手汇集一起。此时，景泰县常生村村民朱克铭正在窑洞避雨。朱克铭把大伙带到窑洞，又生起了几堆火。随后他跑到有信号的地方，拨打了景区的救援热线。张望救援队时，朱克铭又救起一名已经失温倒地的选手。","牧羊人连救六名山地越野赛选手","2021-05-23","130","2021-05-23","827.83","158.26"
"131","@微博综艺 推荐：由特仑苏冠名的向往的生活每周五22:00，我们在一起就是向往的生活！","向往的生活","2021-04-23","131","2021-04-23","910.41","199.88"
"132","综艺  ","龚俊是去录百变大咖秀吗","2021-04-06","132","2021-04-06","1718.59","270.36"
"133","明星  ","吴孟达","2021-02-21","133","2021-02-21","1629.37","327.21"
"134","全国政协常委、中国科学院院士袁亚湘表示，不建议普通孩子学奥数，奥数只是极少数孩子去学的，不适合大范围学习。","院士不建议普通孩子学奥数","2021-03-04","134","2021-03-04","734.94","290.1"
"135","明星  ","宋仲基好帅","2021-03-15","135","2021-03-15","1650.72","326.49"
"136","3月1日起，将全面执行2020年国家医保药品目录，其中，七种罕见病治疗药物纳入医保目录。","3月1日起执行2020年医保药品目录","2021-02-28","136","2021-02-28","972.08","383.11"
"137","国家邮政局统计显示，除夕和初一两天，全国快递处理超过1.3亿件，同比增长223%。快递不打烊，春节也能买买买。给春节坚守岗位的快递小哥道一声，辛苦了！ ​","除夕初一2天全国快递超1.3亿件","2021-02-12","137","2021-02-12","1579.97","308.28"
"138","当地时间13日晚11时许，日本福岛附近海域发生里氏7.1级地震。东京等地有明显震感。","日本7.1级地震","2021-02-13","138","2021-02-13","1223.65","282.42"
"139","宁静表示她这种盲目的从团可能会给大家带来压力，抛开她姐姐们可以非常自如地去演出。","宁静回应单方面宣布退团","2021-02-24","139","2021-02-24","931.52","146.08"
"140",,"吴亦凡在台下看李雪琴演小品","2021-02-12","140","2021-02-12","1350.9","159.83"
