"rank","artist","title","releaseYear","listHighestRank","listType","x","y"
"521","通过国家集中带量采购，冠脉支架价格从均价1.3万元降至700元左右。目前各地使用情况如何？","心脏支架降价后使用情况如何","2021-02-02","521","2021-02-02","1001.23","117.55"
"522","今日@胡杏儿 发布了一组7个月孕期的大片，状态也太好了吧！","胡杏儿7个月孕肚大片","2021-02-04","522","2021-02-04","1879.99","318.63"
"523",,"央视 代孕弃养践踏底线","2021-01-19","523","2021-01-19","1138.77","294.71"
"524","据韩联社16日报道，韩国诚信女子大学教授徐坰德就在尹东柱逝世纪念日当天，再次致函百度百科，要求将尹东柱的国籍从“中国”改为“韩国”。","韩国教授要求将朝鲜族诗人国籍改成韩国","2021-02-16","524","2021-02-16","1013.78","115.26"
"525",,"新录音","2021-01-19","525","2021-01-19","704.41","197.11"
"526","明星-内地  ","Prada终止与郑爽合作","2021-01-19","526","2021-01-19","935.43","216.67"
"527","腊八节的专属奶茶你安排了吗？说一说你要怎么喝腊八粥！","奶茶有被腊八粥冒犯到","2021-01-19","527","2021-01-19","1644.92","226.63"
"528","王鸥姐姐往期舞台票数第一，是单日训练17个小时的姐姐，鸥姐值得！","王鸥往期舞台票数第一","2021-04-16","528","2021-04-16","1480.06","288.82"
"529","近日，四川成都。8岁女童模仿熊出没情节坠楼后身亡案件审结。法院认定，父母承担主要责任，动画制作方承担10%责任。双方庭外和解。原告律师称，案件已进入执行阶段。","女童模仿熊出没情节坠楼案审结","2021-01-19","529","2021-01-19","1715.02","209.86"
"530","央视热评：做官先做人，从政先立德。要让人民群众满意，“官威”必须灭，官德不能丢！从严治吏，刻不容缓！","央视评一记耳光打碎官德","2021-01-19","530","2021-01-19","1116.6","269.8"
"531","1月24日，#2020王者荣耀冬冠# 年度颁奖典礼即将拉开帷幕！颁奖典礼不仅将为大家揭晓年度奖项，还有明星齐聚上演欢乐对决！#王者荣耀明星表演赛#","王者荣耀明星表演赛","2021-01-25","531","2021-01-25","1793.16","161.55"
"532","游戏  ","MSI","2021-05-22","532","2021-05-22","1199.37","222.03"
"533","4月18日22时11分在台湾花莲县（北纬23.92度，东经121.53度）发生5.6级地震，震源深度7千米。","台湾花莲5.6级地震","2021-04-18","533","2021-04-18","952.31","289.02"
"534","河北隆尧谎报核酸检测结果涉事企业被暂停业务，业务代表翟某某已被刑拘。","谎报核酸检测结果涉事企业被暂停业务","2021-01-19","534","2021-01-19","1072.77","335.91"
"535","教育  ","思政大课","2021-05-22","535","2021-05-22","1864.03","191.52"
"536","周笔畅接受采访时被问会推荐哪位好友来参加《姐姐3》，笔笔表示“我就一位好友杨幂，然后你觉得呢？”","周笔畅推荐杨幂参加姐姐3","2021-04-13","536","2021-04-13","1524.11","184.8"
"537","库里空砍39分，勇士加时不敌灰熊无缘季后赛，心疼库日天！","心疼库里","2021-05-22","537","2021-05-22","1539.68","252.87"
"538","5月22日，袁隆平院士的灵车开进湖南杂交水稻研究中心，不少市民自发前来送别，许多人围着灵车失声痛哭。","市民围着袁隆平灵车失声痛哭","2021-05-22","538","2021-05-22","707.45","323.35"
"539","游戏  ","王思聪","2021-01-19","539","2021-01-19","888.83","313.6"
"540","“看这盛世如我所愿，这盛世里，有你有我。你记得我，我就活着。”致敬英烈！","你记得我我就活着","2021-04-03","540","2021-04-03","802.07","248.8"
"541","青春有你3第二十期节目已上线，第三次排名已发布，一起来看看吧！","青你3第三次排名","2021-04-24","541","2021-04-24","772.81","215.45"
"542","1月13日0时至19时，黑龙江省新增新冠肺炎确诊病例40例。","黑龙江新增40例确诊病例","2021-01-14","542","2021-01-14","805.74","226.01"
"543",,"德特里克堡","2021-01-19","543","2021-01-19","960.31","353.65"
"544","无描述","虞书欣 再也不相信姜滨了","2021-03-06","544","2021-03-06","758.35","363.97"
"545","时尚博主gogoboi看到郑爽dy事件后，清空了所有关于女儿菲比的微博，网传其混血女儿疑似系dy所得，对此你们怎么看呢","gogoboi清空女儿微博","2021-01-19","545","2021-01-19","687.85","148.98"
"546","今年五一假期前，一系列涉及“文成广电工作群”男女二人的对话信息在网络上流传。其中，涉事男子被证实为浙江省温州市文成县应急管理局副局长赵青松。澎湃新闻注意到，文成县政府网站5月7日刊发的一则通知显示，文成县政府已于4月29日决定免去赵青松的文成县应急管理局副局长职务。","领导和下属在工作群秀恩爱被免职","2021-05-09","546","2021-05-09","771.84","332.81"
"547","军事  ","烈士肖思远的微信头像","2021-02-20","547","2021-02-20","876.15","119.56"
"548","那时候班婳的伙食…真的是挺丰盛的，现在想想都馋😋","关晓彤剧组伙食","2021-01-20","548","2021-01-20","1379.33","158.36"
"549","其他  ","今晚的月亮","2021-03-28","549","2021-03-28","1475.68","300.58"
"550","石家庄第二轮核酸检测检出阳性病例247例，石家庄检出阳性病例县市区8个，主要分布在藁城区；邢台第二轮核酸检测共检出18例阳性感染者，均来自邢台南宫市。","石家庄检出阳性病例县市区8个","2021-01-16","550","2021-01-16","908.77","307.33"
"551","央视报道陕西洛南脱贫掺假，陕西回应：立即成立调查组对所报道问题进行全面深入调查，有关调查结果将及时公布。","陕西回应洛南扶贫造假问题","2021-04-24","551","2021-04-24","860.58","244.35"
"552","你们有什么试过跟父母沟通自己的婚姻观？他们的态度是怎么样的？带话题一起讨论下吧！","当我问妈妈不结婚可以吗","2021-04-12","552","2021-04-12","1166.09","305.62"
"553","当女孩子来例假～低情商：多喝热水 高情商：少喝冷水","女孩子来例假最希望男孩子说什么","2021-01-12","553","2021-01-12","999.02","282.35"
"554","无描述","甘望星的刘海都在抖","2021-04-24","554","2021-04-24","1580.81","274.05"
"555","继甘望星被学校通报没完成青年大学习后，现在自己说要补做了哈哈哈哈哈哈","甘望星补做青年大学习","2021-04-27","555","2021-04-27","949.84","308.67"
"556","瘦下来并不是最终的目标，接下来好好吃认真练才是美好身材的开始，夏天来了，让我们一起变美吧！","周韦彤一个月瘦了25斤","2021-04-13","556","2021-04-13","732.82","104.64"
"557","无描述","不修音的米卡","2021-04-24","557","2021-04-24","776.22","179"
"558","司藤直播，张彬彬看景甜的眼神太宠溺了！网友都说张彬彬是小猪佩奇！因为全程只有侧脸哈哈哈哈哈","张彬彬看景甜的眼神","2021-04-05","558","2021-04-05","1324.32","310.59"
"559",,"陈道明倪妮感情戏","2021-01-11","559","2021-01-11","900.41","289.63"
"560","2月4日，湖北武汉。江夏区法院审理一起酒驾致死案件。王某获邀与多个朋友吃饭，之后醉酒驾驶主人李某车辆，送李某、陈某离开，期间发生车祸致陈某死亡。王某对事故负主责，死者家属将11人起诉索赔。","男子酒驾致朋友死亡同桌7人被判","2021-02-05","560","2021-02-05","871.99","372.18"
"561","芒果TV《婆婆和妈妈2》茶话会杜淳爆料曾被老婆王灿拉黑过25次以上...","杜淳被王灿拉黑过25次以上","2021-04-28","561","2021-04-28","871.57","384.51"
"562","当地时间18日凌晨，应美方邀请，中方代表团成员抵达美国安克雷奇并下榻当地酒店，中美高层战略对话即将举行。","中美高层战略对话中方代表团抵达美国","2021-03-18","562","2021-03-18","1799.72","298.37"
"563","1月13日0时至19时，黑龙江省新增新冠肺炎确诊病例40例。","黑龙江新增40例确诊病例","2021-01-13","563","2021-01-13","1628.11","178.74"
"564","明星  ","别叫我达叔 叫我达哥","2021-02-27","564","2021-02-27","1177.14","166.77"
"565","李易峰在春晚进行时的互动里一把搂过朱一龙的腰，这是免费能看的吗","李易峰搂朱一龙的腰","2021-02-09","565","2021-02-09","1233.48","338.1"
"566","吴青峰出庭与林暐哲著作权纠纷案，在庭后采访中他也哽咽回应一想到妈妈还得担心这些事情会觉得有点扛不住。","吴青峰哽咽回应著作权纠纷","2021-03-30","566","2021-03-30","1357.88","224.7"
"567","全国人大代表、编剧蒋胜男建议，取消国家公务员报考35岁以下的年龄限制。","建议公务员考试打破35岁门槛","2021-03-07","567","2021-03-07","1536.42","289.98"
"568","明星  ","肖战走秀","2021-04-07","568","2021-04-07","1173.61","137.85"
"569","特斯拉提供数据显示：事故前半小时刹车超40次，最后一次踩下制动踏板时，车辆时速为118.5km/h，碰撞前时速降至48.5km/h。","特斯拉提供刹车事故前1分钟数据","2021-04-22","569","2021-04-22","725.07","393.45"
"570","中央文明办确定2021—2023年创建周期全国文明城市提名城市名单","全国文明城市最新提名城市名单","2021-01-29","570","2021-01-29","916.25","227.09"
"571","这个经历实在太尴尬了！让小朋友直呼“叔叔你别拉了，我害怕”","叔叔你别拉了我害怕","2021-04-27","571","2021-04-27","1904.8","188.02"
"572","无描述","殷世航订婚现场","2021-05-15","572","2021-05-15","1100.64","354.55"
"573","明星  ","脱粉","2021-04-14","573","2021-04-14","1053.53","199.77"
"574","朴灿烈在EXO官咖发布长文，向等待了很长时间的粉丝表达歉意。","朴灿烈向粉丝道歉","2021-02-24","574","2021-02-24","742.58","166.05"
"575","1月4日，山东省疾病预防控制中心完成对青岛报告的1例英国输入病例样本全基因测序分析，经比对，与近期高度关注的英国变异株序列高度同源。该病例为山东省第一例输入的新冠病毒VUI-202012/01突变体感染病例。","山东发现首例新冠变异毒株感染确诊患者","2021-01-05","575","2021-01-05","696.85","187.48"
"576","明星-内地  ","杜海涛沈梦辰","2021-05-13","576","2021-05-13","903.02","234.05"
"577","奥斯卡评委夸易烊千玺：他的表演令人惊叹，你知道我的不会讲中文，我看的时候主要看表演和演技","奥斯卡评委夸易烊千玺","2021-04-22","577","2021-04-22","1885.67","278.08"
"578","无描述","景甜说看刘宇宁直播路转粉了","2021-05-09","578","2021-05-09","1136.67","366.85"
"579","《王牌对王牌》第六季快乐回归！王牌登场，笑不可挡！1月29日起，每周五晚20:20，你的快乐就在这里！","王牌对王牌","2021-04-16","579","2021-04-16","1311.53","257.45"
"580","日本第一代白毛女“喜儿”的扮演者、著名芭蕾舞蹈家松山树子日前在日本东京去世，享年98岁。对此，外交部发言人赵立坚5月24日表示，松山树子女士是中国人民的老朋友，为推动中日友好交流作出了重要贡献。","外交部哀悼日本第一代白毛女喜儿扮演者","2021-05-24","580","2021-05-24","1064.93","264.59"
"581","《乘风破浪的姐姐2》成团之夜官宣第一波嘉宾，万茜、孟佳、李斯丹妮、张雨绮、郁可唯、黄龄将到现场见证第二季的成团之夜。你最期待哪位姐姐？","乘风破浪的姐姐成团之夜","2021-04-16","581","2021-04-16","709.39","209.74"
"582","周震南作为师哥出席创4见面会，被问到哇唧唧哇成团率，周震南都被学员放狠话吓到了哈哈哈哈哈哈哈周震南弱小可怜又无助：龙总你快来吧","周震南被问哇唧唧哇成团概率","2021-02-24","582","2021-02-24","1470.83","191.1"
"583","杭州给春节在杭外来务工人员发1000元大红包！非浙江户籍、在杭缴纳社保外来务工人员可领，“一键直达”银行账户","非浙籍留杭过年务工人员可领1000元","2021-01-18","583","2021-01-18","1924.46","279.74"
"584","各位我没有倒下,只是眼睛看不清做了个手术！新年愿望希望大家都好好滴","胡兵眼部手术全记录","2021-02-10","584","2021-02-10","1410.84","295.83"
"585","2021世界排球联赛，中国队状态不佳，0-3不敌日本队。期待下场对阵泰国，中国队能够找回状态！","中国女排不敌日本女排","2021-05-26","585","2021-05-26","1153.88","174.62"
"586","甘望星求求你出书吧，教教我如何钓纯情少男，你怎么这么会啊","希望甘望星教我如何钓男人","2021-04-05","586","2021-04-05","1167.69","345.49"
"587","大连市计划于24日24时下调为低风险地区，届时大连市全域将均为低风险地区。","大连全域低风险","2021-01-25","587","2021-01-25","1168.34","248.95"
"588",,"唐探4 伦敦","2021-02-12","588","2021-02-12","1301.11","157.26"
"589","陈芳语在采访时回应热依娜的藏头歌，表示：“最开始我只是在分享一件事情，我没有恶意，当时我们就和好了。”还称自己现在看不太懂简体字了。","陈芳语回应热依娜藏头歌","2021-03-14","589","2021-03-14","755.07","210.81"
"590","《我是女演员》教导主任刘涛微博评论区回复粉丝，可以把张哲瀚龚俊旁边的自己p掉，涛姐yyds，晚上8点必须把刘涛好会四个字打在公屏上！ ​","刘涛 可以把我p掉的","2021-04-17","590","2021-04-17","1020.44","216.7"
"591","任正非在华为内部发全员公告：就注册姚安娜商标事件进行道歉。","任正非就华为注册姚安娜商标道歉","2021-02-03","591","2021-02-03","1164.76","162.84"
"592","据说伊能静50分钟就熟悉了剧本和舞台，直接演绎《隐秘的角落》的王瑶。","伊能静50分钟速成隐秘的角落","2021-01-16","592","2021-01-16","1269.29","347.37"
"593","向佐刚刚发文表白女儿和妻子郭碧婷，“以後，我們大手牽小手，一起向前走。謝謝老婆，辛苦了！謝謝cora，我愛你們！ ”","向佐郭碧婷女儿出生一百天","2021-01-09","593","2021-01-09","1492.39","289.62"
"594","伤疤未好又“闯祸”，H&M究竟唱的哪一出？敬告H&M等企业，别突破底线、触碰红线、挑战高压线。","央视评HM伤疤未好又闯祸","2021-04-02","594","2021-04-02","1497.21","169.88"
"595","河南驻马店泌阳高店镇一名智力残障的年轻女孩嫁55岁男子一事，引发网友热议。3月1日下午，当事男子张某某回应澎湃新闻称，他今年55岁，女孩22岁，已满结婚年龄。这门亲事双方家庭都已经同意。","55岁男子回应娶年轻智障女孩","2021-03-01","595","2021-03-01","989.2","120.11"
"596",,"王中磊儿子长大了","2021-01-10","596","2021-01-10","1326.88","175.62"
"597","315记者“老K”讲述卧底汽车销售公司经历，当年为了拿到核心资料和证据，一着急一努力便从销售做到了高管。","记者卧底销售公司业绩出众成二把手","2021-03-16","597","2021-03-16","1161.03","372.78"
"598","据韩联社报道，韩国司法界23日消息，检方上月23日扣押韩国前总统朴槿惠位于首尔内谷洞的私宅，以追缴其拖欠的罚金和犯罪所得金额。","韩国检方扣押朴槿惠私宅","2021-03-23","598","2021-03-23","750.3","133.11"
"599","据每日邮报报道，比尔·盖茨婚后与前女友温布拉德密会的地方位于北卡罗莱纳州卡罗拉市，占地面积为1440平方英尺（约134平方米）的一处海滨别墅。该房屋建于1982年，从2016年开始挂牌出租，租金大概是每天600美元。","盖茨婚后与前女友度假豪宅","2021-05-08","599","2021-05-08","1658.96","213.54"
"600","电商  ","李佳琦直播","2021-05-22","600","2021-05-22","1791.21","225.24"
"601","其他  ","花一千块钱在日本租个男朋友","2021-02-24","601","2021-02-24","1717.65","252.15"
"602","21日下午，上海举行新冠肺炎疫情防控新闻发布会，上海市卫健委主任邬惊雷通报，1月21日，上海报告3例新冠肺炎本土确诊病例。 ​","上海报告3例本地确诊病例","2021-01-21","602","2021-01-21","1696.57","280.92"
"603","无描述","司藤庆功宴","2021-04-26","603","2021-04-26","620.95","317.24"
"604","读书  ","赘婿","2021-02-18","604","2021-02-18","1197.65","297.19"
"605","无描述","全职太太离婚获5万家务补偿","2021-02-21","605","2021-02-21","1040.31","268.87"
"606","瑞典服装品牌H&M首席执行官称，据保守估算，2021年将净关店250家，目前在中国关闭约20家门店。此前，据H&M中国官网2月公布的数据，截至2020财年，H&M集团在全球74个市场共开设5018家门店。截至2020年财年年底，H&M在中国内地146个城市共拥有445家门店。","HM在华关闭约20家门店","2021-03-31","606","2021-03-31","1048.56","289.69"
"607","无描述","蓝盈莹妈妈身材","2021-04-11","607","2021-04-11","1163.36","384.61"
"608","据天眼查，李诞和黑尾酱名下的上海乐写贸易有限公司已于近日注销，注销原因为决议解散。","李诞黑尾酱合资公司注销","2021-03-18","608","2021-03-18","1447.5","221.7"
"609","无描述","造型师回应李梦躺着做头发","2021-01-05","609","2021-01-05","1024.39","395.34"
"610","3月12日，一条""江苏女辅警与多人发生关系敲诈获刑""的消息在网络流传。@潇湘晨报 记者查证后，此消息来源为江苏省灌南县人民法院的一份判决书。受害人包括公安局副局长、派出所所长、卫生院副院长、小学校长等多名公职人员。","女辅警勒索多名公职人员370万","2021-03-12","610","2021-03-12","736.75","143.27"
"611","无描述","小李琳 这是最后一次扮演杜冰雁","2021-03-26","611","2021-03-26","809.55","370.79"
"612","社会  ","建议禁止在职中小学老师有偿补课","2021-03-09","612","2021-03-09","1213.25","167.77"
"613","上海市场监管部门近日突击检查了部分奶茶店，涉及1点点、茶百道、7分甜、都可（coco）、熊姬等品牌，结果发现全部存在问题。","上海抽检奶茶店全部存在问题","2021-02-23","613","2021-02-23","1143.9","225.41"
"614","@微博综艺 推荐：由特仑苏冠名的向往的生活每周五22:00，我们在一起就是向往的生活！","向往的生活","2021-05-14","614","2021-05-14","1112.86","353.66"
"615","专家提醒，猝死发生前的身体信号包括持续觉得胸口不舒服，爬楼或走路稍快感觉胸闷气短，突然眼前一黑倒下几秒，直系亲属有猝死的发生等等。","猝死有这些身体信号","2021-02-22","615","2021-02-22","1389.4","337.95"
"616","最近一批美国政客炒起了新冠病毒溯源的“冷饭”。美国有线电视新闻网（CNN）27日拉来一位美国哈佛大学传染病教授李普斯奇，设计提问想要引导他为一些阴谋论来背书，却被这名教授吐槽“胡说”。","CNN挖坑病毒从武汉泄露当场翻车","2021-05-28","616","2021-05-28","759.25","340.9"
"617","明星  ","Angelababy美甲","2021-02-11","617","2021-02-11","1505.08","342.04"
"618","近日，市场监管总局等五部门约谈特斯拉公司，要求其严格遵守中国法律法规，加强内部管理，落实企业质量安全主体责任。","特斯拉被五部门约谈","2021-02-08","618","2021-02-08","852.58","252.2"
"619","明星  ","肖宇梁","2021-03-24","619","2021-03-24","1516.98","213.73"
"620","广东男篮在20-21赛季总决赛中以2-1击败辽宁，夺得本赛季CBA总冠军！","广东男篮队史第11次夺冠","2021-05-01","620","2021-05-01","1235.69","194.23"
"621","在全球各大城市，由于高房价以及频繁的人口流动，住房租赁市场十分活跃。在国内一线城市，年轻人租房的时间越来越长。一份针对7万多名租房人的问卷显示：超过1/4的人租住长达5年以上，超过6成的租房人租住时间超过3年。","一线城市年轻人租房时间越来越长","2021-03-25","621","2021-03-25","1768.57","196.14"
"622","Facebook CEO马克·扎克伯格（Mark Zuckerberg）周四表示，Facebook将无限期封禁美国总统特朗普的帐号。","Facebook将无限期封禁特朗普账号","2021-01-08","622","2021-01-08","546.53","230.7"
"623",,"无效化妆 有效化妆","2021-02-16","623","2021-02-16","1422.06","248.22"
"624","多位明星工作室接连注销，是有什么大瓜要来了吗？！！","明星工作室接连注销","2021-04-28","624","2021-04-28","1000.2","174.03"
"625",,"成都双流金桥","2021-01-19","625","2021-01-19","1706.47","247.68"
"626","无描述","赖冠霖机场穿拖鞋","2021-03-25","626","2021-03-25","1317.06","288.63"
"627","3月18日，美国知名连锁餐厅“得克萨斯客栈”创始人和CEO因难忍新冠肺炎后遗症自杀身亡，享年65岁。他的遗体在其位于肯塔基州的住宅附近被发现。其家人称他生前遭遇了包括严重耳鸣在内的新冠后遗症，由于病情愈发严重最终走上绝路。","难忍新冠后遗症美国一CEO自杀","2021-03-22","627","2021-03-22","831.86","269.69"
"628","电影  ","可是我妈现在还不会缝啊","2021-02-17","628","2021-02-17","812.09","259.23"
"629","《希望的田野》杨迪妈妈化身rapstar，随后杨迪发文艾特GAI看妈妈潜力如何，GAI直接回复：丽姐的rap让人着迷。","GAI说杨迪妈妈的rap让人着迷","2021-01-24","629","2021-01-24","1222.8","343.43"
"630",,"杨幂走路带风","2021-01-10","630","2021-01-10","1019.4","384.62"
"631","今日晚间，拼多多纳斯达克公告称，2020年净亏71.8亿元，每股亏损151元。2019年净亏69.68亿元。","拼多多2020年净亏71.8亿元","2021-04-30","631","2021-04-30","687.19","324.17"
"632","4月23日，黑龙江一东北虎下山进村。21时左右，这只老虎已被控制住。","进村东北虎已被控制","2021-04-23","632","2021-04-23","1901.33","216.53"
"633","无描述","张小斐路演服装品牌变化","2021-02-22","633","2021-02-22","1104.11","382.51"
"634","带话题说说看，你现在多大了，一般怎么称呼妈妈....","从妈妈改口到妈的岁数","2021-04-07","634","2021-04-07","1077.7","178.02"
"635","无描述","温客行","2021-03-01","635","2021-03-01","733.24","315.56"
"636","记者整理了郑爽、黄晓明、何炅、黄圣依、唐嫣、赵薇等75位一线艺人相关公司发现，75位艺人名下相关公司共有647家，其中已注销200家。","75位一线艺人注销200家关联公司","2021-04-29","636","2021-04-29","1127.88","395.9"
"637","2021年1月16日13时，大庆市新增确诊病例1例（龙凤区），为安达市无症状感染者的密切接触者，目前在市第二医院隔离治疗。截至2021年1月16日，大庆市现有确诊病1例（龙凤区），无症状感染者1例（萨尔图区）。","大庆新增确诊病例1例","2021-01-16","637","2021-01-16","847.02","117.75"
"638","全国政协委员、西安电子科技大学教授刘三阳建议：小学入学年龄应以年度划线，将学龄时段的划分节点从每年8月31日调为12月31日。","建议调整小学入学年龄划分节点","2021-03-05","638","2021-03-05","822.62","173.98"
"639","“驻华韩国文化院”22日发布“大韩民国第13期‘纠错改正团’招募公告”。公告称，韩国文化体育观光部海外文化弘报院为传播正确的韩国信息及韩国文化，成立了“纠错改正团”。通过“韩国纠错改正服务”，纠正世界各地有关韩国的错误信息，提升国家形象。","驻华韩文化院成立纠错改正团","2021-02-24","639","2021-02-24","997.54","365.72"
"640",,"lsy0001 yb0009","2021-01-19","640","2021-01-19","1114.11","370.16"
"641","为什么小岳岳在和一位长得很像他的消防员连线时直摇头？","岳云鹏听消防员唱五环时表情凝固了","2021-02-16","641","2021-02-16","1333.35","252.24"
"642","郑爽向金晨道歉又删博后再次发文，“感谢一路支持，你们没变我变了，真金不怕火炼。攻击我，我低下头举起双臂：反弹！out我特慢！”同时关注了金晨。 ​","郑爽 攻击我反弹","2021-01-13","642","2021-01-13","1060.43","161.11"
"643","无描述","蔡徐坤 没说不能拿电脑啊","2021-04-23","643","2021-04-23","896.9","371"
"644",,"明天就轮到张小斐演贾玲妈","2021-02-11","644","2021-02-11","1820.11","212.23"
"645","唱歌好听又努力的和马竟然连考核视频都没有就被列入F班[疑问]","和马F班","2021-03-13","645","2021-03-13","1184.04","359.91"
"646","无描述","小马云","2021-02-20","646","2021-02-20","1670.51","240.17"
"647","INTO1官博在微博发声明，称INTO1第一次成团出行遭遇了机场人群聚集现象，官博呼吁严禁任何形式的跟机、跟车，不在机场聚集，拒绝围堵艺人等不当行为。","INTO1声明","2021-04-26","647","2021-04-26","1092.41","242.26"
"648","数据显示，2020年全国城镇非私营单位就业人员年平均工资为97379元，比上年增长7.6%","2020年平均工资","2021-05-19","648","2021-05-19","1647.15","214.68"
"649","刘诗诗参加活动被玩偶打到头的反应太可爱了啊啊啊，刘诗诗好温柔","刘诗诗被打到头的反应","2021-04-14","649","2021-04-14","1119.51","224.21"
"650",,"猫 老虎 被雨淋湿的狗狗","2021-01-05","650","2021-01-05","1538.35","186.97"
"651","朱锁锁与谢宏祖结婚之后怀孕，但两人最终能甜到大结局吗？期待后面的剧情~","朱锁锁怀孕","2021-01-12","651","2021-01-12","1596.2","262.32"
