"rank","artist","title","releaseYear","listHighestRank","listType","x","y"
"1439","BBC还把没有查证的原因归结于中国对记者的“严格限制”，这纯属猪八戒抡家伙——倒打一耙。","辽宁新增1例本土确诊","2021-05-16","1439",,"1851.39","332.05"
"1440","社会  ","诛仙","2021-01-30","1440",,"518.18","282.37"
"1441","无描述","2分钟速览中美高层战略对话首日","2021-03-19","1441","top40","855.84","334.92"
"1442","明星-内地  ","锦心似玉","2021-02-26","1442","top40","1855.63","289.33"
"1443","恭喜肖战、杨紫荣获2020#微博KING和QUEEN#！郭炜炜、薇娅、李佳琦、李子柒、Uzi荣获2020#年度热点人物#！纯甄2021料你好运，期待在盛典现场和你共同见证荣誉加冕！","成都49中","2021-05-10","1443","top40","1875.54","261.36"
"1444","王嘉尔发现自己没戴口罩后的反应，哈哈哈哈哈哈哈哈哈哈哈要被王嘉尔笑死，这反应也太可爱了吧","金扫帚奖","2021-03-28","1444",,"699.44","208.03"
"1445","电影  ","上海武康路蝴蝶结已被摘除","2021-05-08","1445","top40","1601.03","253.88"
"1446",,"霍思燕","2021-01-22","1446","top40","1175.29","281.36"
"1447","据美国有线电视新闻网（CNN）消息，现任总统特朗普和第一夫人梅拉尼娅刚刚乘坐直升机离开白宫，前往安德鲁斯空军基地，他将在那里举行一个简短的告别仪式。据报道，他随后将前往佛罗里达州。","建议适当放宽小学新生入学年龄","2021-03-09","1447",,"578.63","273.55"
"1448","互联网  ","尹正说张小斐要说到做到","2021-03-07","1448","top40","1350.02","257.7"
"1449","@网易云音乐 和@酷狗音乐 的年前大瓜似乎还远没到头，2月4日网易云 再发长文，根据2月2日酷狗的回应（图2）再次开怼，表示酷狗列出的专利文档是”驴唇不对马嘴“的诡辩。 ​","韩商言又问吴白借钱","2021-02-04","1449",,"894.7","282.1"
"1450","2021年5月22日，“杂交水稻之父”袁隆平逝世，享年91岁。“中国肝胆外科之父”吴孟超逝世，享年99岁。","广西北流市民自愿排长队献血","2021-04-28","1450",,"1565.59","206.87"
"1451","拜登继续将抗疫当做首要目标，他承诺用“全面战争”状态抗击疫情，","桐庐偶遇邓超孙俪","2021-04-09","1451",,"1002.43","193.45"
"1452","杨洋把酒喝漏了，未免太可爱了，帅不过三秒哈哈哈哈，今天也是被杨洋萌到一天。","微博之夜口罩","2021-02-28","1452","top40","1911.76","294.36"
"1453","本届奥斯卡公布提名，中国香港选送的《少年的你》提名最佳国际影片。","上阳赋致歉信","2021-01-21","1453","top40","1358.82","336.85"
"1454","无描述","肖战戴耳机猜题","2021-05-17","1454","top40","1848.65","293.59"
"1455","无描述","毛晓彤","2021-01-30","1455",,"1803.37","163.35"
"1456","社会  ","赵露思希望大家爱上乐嫣小公主","2021-03-31","1456","top40","1818.63","301.43"
"1457","据加拿大《多伦多星报》报道，加拿大政府正式决定将极右翼组织“骄傲男孩”列为恐怖组织。","陈晓 跳楼那个是专业的武行兄弟","2021-01-05","1457",,"666.63","208.4"
"1458","无描述","龚俊牵辛芷蕾下台","2021-03-31","1458","top40","989.03","342.23"
"1459","之前微博之夜没赶上红毯的张雨绮又叒叕没赶上东方卫视品质盛典的红毯。专业红毯错过人就是小雨没错了哈哈哈","韩美娟造型","2021-04-24","1459","top40","1062.78","336.12"
"1460","社会  ","袁花花再也无法陪袁隆平听汇报了","2021-05-23","1460","top40","879.54","310.53"
"1461","无描述","青瓦台回应朴槿惠获刑22年","2021-01-14","1461","tip","1605.84","260.29"
"1462","无描述","何同学采访苹果CEO","2021-02-18","1462","top40","1209.06","227.47"
"1463","1月19日上午，郑爽与张恒民间借贷纠纷案在上海市第二中级人民法院二审开庭审理。此前，该案在上海市静安区人民法院一审终结，一审原告为郑爽，被告为张恒。郑爽、张恒并未现身。","辽宁营口9地升级为中风险","2021-05-14","1463","top40","1624.81","231.67"
"1464","5月29日夜间，南京发生男子驾车撞人并持刀捅人事件。见义勇为市民目前暂无生命危险。","李亨利","2021-04-14","1464","top40","1476.8","265.47"
"1465","综艺-内地综艺  ","恋爱中分享欲很重要吗","2021-05-07","1465","top40","849.48","388.48"
"1466","《妻子的浪漫旅行5》蒋勤勤回忆有一次和陈建斌吵架后，陈建斌气的戴了一个星期的墨镜！","龚俊不愧演过消防员","2021-04-11","1466","top40","1569.88","297.89"
"1467","无描述","Vans联合创始人去世","2021-05-08","1467",,"1687.12","318.24"
"1468","刘烨粉丝发帖曝光刘烨助理性骚扰自己，粉丝本人已报警，等个后续结果回应","李诞道歉","2021-02-25","1468",,"1184.63","379.21"
"1469","国产车厘子价格升至120元每斤：进口车厘子已下市，国产品质更好。","吴磊给迪丽热巴吹风扇","2021-04-11","1469","top40","1639.94","208.02"
"1470","肖战想帮女明星提下裙子提了个寂寞
发现无从下手后只好装作无事发生","农村药店发现买退烧药的患者2小时内报告","2021-01-21","1470","top40","1768.07","213.76"
"1471","自2021年1月10日起，将石家庄新乐市人大宿舍、药材公司宿舍、张家庄村，高新区赵村新区小区、主语城小区，无极县东北远村、西郝庄村调整为中风险地区。","小学生让骗子自挂电话","2021-05-12","1471","top40","1714.01","294.9"
"1472","明星  ","北京取消特字头公交路号","2021-01-30","1472","top40","1033.9","226.44"
"1473","明星  ","许光汉终止与ck彪马合作","2021-03-25","1473","top40","1382.21","266.3"
"1474","明星  ","你的CP为什么be了","2021-05-30","1474","top40","1804.26","209.97"
"1475","综艺  ","张哲瀚龚俊背影杀","2021-05-04","1475","top40","1175.28","334.82"
"1476","余佳桂因工作原因从1997年起，就与袁隆平接触，24年留下了500多张照片。她说，袁老最喜欢格子、条纹的衣服，每次拍照前都会整理一下摆个pose，态度非常和蔼，没有架子。","长歌行","2021-04-01","1476","top40","759.46","184.86"
"1477","孟佳发文喊话韩美娟：“姐决定了，给你定制一个不会掉的假发片！！！”","天津入境病例首次检出英国毒变异株","2021-01-21","1477","top40","1453.93","284.54"
"1478","27日后半夜到28日白天，北京将出现大风沙尘天气，其中28日早晨和白天将达到沙尘暴级别。气象部门提醒市民尽量减少外出。","哈尔滨新增10例确诊","2021-01-21","1478","top40","1403.21","241.55"
"1479",,"建议给单身青年提供租购房优惠","2021-03-09","1479","top40","1781.73","228.56"
"1480","《有翡》中@孙坚 扮演的殷沛一角下线@赵丽颖 转发孙坚对殷沛角色理解的那条微博，阿翡和阿沛下辈子要做朋友呀！","肛拭子受采者讲述采样过程","2021-01-24","1480","top40","1033.47","217.96"
"1481","4月26日，人社部发布2021年第一季度全国招聘大于求职“最缺工”的100个职业排行。","你好李焕英票房破20亿","2021-02-16","1481","top40","1655.34","258.42"
"1482","这是咱们新疆雪白的棉花！ 转起！ 我们新疆好地方！","舒肤佳声明","2021-04-23","1482","top40","1197.18","355.13"
"1483","记者从中南大学湘雅医院获悉，“杂交水稻之父”、中国工程院院士、“共和国勋章”获得者袁隆平，5月22日13点07分在湖南长沙逝世，享年91岁。","我爸给狗穿上了我的衣服","2021-04-26","1483","top40","1242.17","201.24"
"1484",,"严良朱朝阳身高差","2021-04-23","1484","top40","1594.48","309.27"
"1485","唐嫣15年前拍摄的电视剧上线播出了，唐嫣演一名农村女孩，满脸胶原蛋白。","专家初判青海地震与云南地震没有关联","2021-05-22","1485","top40","863.62","336.75"
"1486","滴滴出行：通过车内录音、录像核实，乘客行程途中并未有异常情况发生，在达到目的地后正常下车。","齐齐哈尔咬死羊的动物不是狼是狗","2021-05-14","1486","top40","672.04","232.9"
"1487","白敬亭给倪妮写的祝福是行，落款是帅哥 ​​，可以这很白敬亭","景甜气质","2021-03-10","1487","top40","1102.34","230.35"
"1488","看小舍得真的被田雨岚气死，这个人设真的好让人无语啊","范丞丞穿女装比薇娅好看","2021-04-02","1488","top40","811.82","154.12"
"1489","刘浩存在新作品中的演技饱受争议，你觉得怎么样？？？","华晨宇邓紫棋同台领奖","2021-02-28","1489","top40","1025.44","176.89"
"1490","近期，有网友表示，自己去吃刺身吃出绿色异物，他该怎么办？律师对此表示，这种情况是属于《食品安全法》里不符合安全标准的食品，可以向商家去主张价款的10倍进行赔偿。","郭麒麟放风筝像遛狗","2021-04-20","1490","top40","1159.65","195.22"
"1491","国务院应对新冠疫情联防联控机制综合组和中央农村工作领导小组办公室制定《冬春季农村地区新冠肺炎疫情防控工作方案》。方案指出，返乡人员需持7天内有效新冠病毒核酸检测阴性结果返乡，返乡后实行14天居家健康监测，期间不聚集、不流动，每7天开展一次核酸检测。","有翡","2021-01-21","1491","top40","1655.81","274.22"
"1492","华晨宇、关晓彤带来歌舞表演《护花使者》，两人复古港风造型也太靓啦！欢快的音乐加上雀跃的舞步，大家快来一起尽情摇摆吧~ ​","易烊千玺回应春晚戴假发","2021-02-06","1492",,"1306.71","174.55"
"1493","新疆经济一直在发展，棉花产业机械化采收率今年或将达85%，纺织工厂现代化程度很高，员工工资在发展中国家也处较高水平。","掌掴市政府秘书长的市委书记被免职","2021-01-21","1493","top40","817.69","275.14"
"1494","无描述","马来西亚6月1日起实施全国全面封锁","2021-05-28","1494","top40","764.39","372.09"
"1495","2月27日，吴孟达因肝癌救治无效去世，享年69岁。","张雨绮 这一年嘴都没闲着","2021-01-12","1495",,"1295.89","334.42"
"1496","何老师在《创造营2021》成团夜直播时称由于数据后台火爆，导致创造营撑腰数据丢失，并代表鹅道歉。随后节目组作出回应⬇️","女辅警敲诈案7名公职人员被处分","2021-03-12","1496","top40","780.07","313.25"
"1497","《你好，李焕英》由贾玲编剧并执导，贾玲、张小斐、沈腾、陈赫主演。献给每位观众的妈妈，正在热映中。","宋茜终止与HM合作","2021-03-24","1497","top40","1052.71","156.43"
"1498","无描述","微博新表情牛轰轰","2021-01-21","1498",,"1225.23","214.12"
"1499","曲艺名家马增蕙去世，享年85岁，马增蕙为著名单弦表演艺术家，第五批国家级非物质文化遗产代表性项目代表性传承人，她出生于1936年，其父马连登、其姐马增芬都是西河大鼓表演艺术家，其儿子是以演唱歌曲《笑脸》成名的谢东。","中国好声音 海选","2021-05-24","1499","top40","1739.57","289.35"
"1500","近日，上海三年级小学生金蔓清发现自己使用的英语课本出现马戏团动物表演内容，她觉得内容有错误引导。在妈妈的鼓励下，金蔓清向出版社反映了该问题。出版社表示会在下次修订时换掉这部分内容。","心疼胡明轩","2021-04-29","1500","top40","1159.36","205.94"
"1501","一些研究通过临床样本或储存的血清样本发现2019年已存在新冠肺炎病例，世卫组织将跟进这些研究，但可能永远不会发现新冠肺炎零号病例。","难听","2021-05-18","1501",,"653.11","316.18"
"1502","2021牛年春晚节目单正式出炉，同时主持人阵容官宣，有任鲁豫、李思思、尼格买提、龙洋、张韬。大家最期待哪个节目呢？","杨幂换头像","2021-01-30","1502","top40","648.43","260.38"
"1503","朋友们，你们和同学之间有没有闹过比较尴尬的误会？带话题一起来聊聊吧！","何凯文","2021-01-20","1503","top40","1281.46","359.83"
"1504","浙江卫视今晚播出节目调整了，支持！致敬袁老，一路走好","叙利亚总统及妻子新冠检测呈阳性","2021-03-08","1504","top40","799.41","325.7"
"1505","田启文在采访中透露吴孟达病情，称他在去年底发现患上了肝癌，癌细胞已经开始扩散。","明日起泸州老窖全面全国停货","2021-01-27","1505","top40","1004.32","306.59"
"1506","张雪迎因为亲姐姐和粉丝之间的矛盾，发长文向粉丝道歉： “我希望我们一直能像从前那样，纯粹地成为彼此的动力和支柱，充满着正能量。”","和马希望能尽快用微博","2021-04-28","1506","top40","1836.74","282.87"
"1507","社会  ","奇葩说","2021-01-21","1507","top40","767.28","180.44"
"1508","1月18日0时至24时，北京新增1例本地确诊病例和1例无症状感染者。其中，无症状感染者系确诊病例之外孙。","郑恺苗苗录制跑男","2021-04-27","1508","top40","1137.56","218.02"
"1509","其他  ","上海肿瘤医院","2021-01-20","1509","tip","1002.52","357.26"
"1510","1月28日0-24时，黑龙江省新增新冠肺炎确诊病例21例。","哲仁王后","2021-01-24","1510","top40","1722.65","200.27"
"1511","财经  ","央视评阳刚之气不只是男性化","2021-01-30","1511","top40","1303.28","147.52"
"1512","《我的时代你的时代》杨紫饰演的佟年回归啦，吴白艾情在交东大学遇到佟年！","帝吧","2021-02-04","1512","top40","750.46","331.27"
"1513","全国政协委员马秀珍建议，将性健康教育纳入中学生教育课程体系。","德拉蒙德加盟湖人","2021-03-29","1513","top40","1376.37","241.03"
"1514","近日，华为轮值董事长胡厚崑在公司内部宣布：华为2020年持续实施股票分红，预计每股1.86元。一位华为中层持股员工对界面新闻表示：“公司在遭遇制裁后，原以为今年分红会在每股1.5元以下，没有想到最终定价达1.86元，我自己还是感到满意。”","唐艺昕芭比泡泡裙造型","2021-03-20","1514","top40","961.18","293.71"
"1515","明星-内地  ","郑恺的教练是苏炳添","2021-05-14","1515",,"1126.76","369.04"
"1516",,"创造营排名","2021-04-21","1516","top40","879.56","378.71"
"1517","人民日报四问通化物资配送问题，回应如下：①目前通化市粮油菜肉蛋奶等基本生活物资储备充足，不存在短缺现象；②通化装配蔬菜包以成本价直送家中；③通化计划组织7000多人为封闭小区配送物资；④通化市民可携近期2次核酸结果阴性证明，报名当志愿者。","中方已向美方提供口罩约420多亿只","2021-01-21","1517","top40","924.61","317"
"1518","财经  ","潘玮柏","2021-03-31","1518",,"845.97","229.22"
"1519","社会  ","谭松韵 跳舞时特别注意了表情管理","2021-04-10","1519","top40","1140.75","181.29"
"1520","钟楚曦工作室发声明宣布钟楚曦与耐克公司合作已到期，且没有续约。","印度拒绝联合国物资驰援","2021-04-30","1520","tip","798.09","187.8"
"1521","通过国家集中带量采购，冠脉支架价格从均价1.3万元降至700元左右。目前各地使用情况如何？","近期非必需不前往六安合肥中风险地区","2021-05-14","1521","top40","1473.76","242.81"
"1522","今日@胡杏儿 发布了一组7个月孕期的大片，状态也太好了吧！","郭艾伦太难了","2021-05-01","1522","top40","1384.17","251.18"
"1523",,"印度法官建议强奸犯娶受害者换免罪","2021-03-05","1523","top40","1406","224.69"
"1524","据韩联社16日报道，韩国诚信女子大学教授徐坰德就在尹东柱逝世纪念日当天，再次致函百度百科，要求将尹东柱的国籍从“中国”改为“韩国”。","北斗掉线","2021-04-08","1524","top40","1152.24","343.29"
"1525",,"张文宏呼吁你快速我快速","2021-01-21","1525",,"962.19","138.56"
"1526","明星-内地  ","那英 对付杨钰莹我还是可以的","2021-04-16","1526",,"1653.83","222.04"
"1527","腊八节的专属奶茶你安排了吗？说一说你要怎么喝腊八粥！","蒋南孙王永正分手","2021-01-13","1527","top40","1023.24","142.76"
"1528","王鸥姐姐往期舞台票数第一，是单日训练17个小时的姐姐，鸥姐值得！","大桥道涉疫雪糕流入天津市场390盒","2021-01-15","1528",,"880.37","366.9"
"1529","近日，四川成都。8岁女童模仿熊出没情节坠楼后身亡案件审结。法院认定，父母承担主要责任，动画制作方承担10%责任。双方庭外和解。原告律师称，案件已进入执行阶段。","台湾女司机被劫吼哭匪徒","2021-01-09","1529","top40","959.9","189.68"
"1530","央视热评：做官先做人，从政先立德。要让人民群众满意，“官威”必须灭，官德不能丢！从严治吏，刻不容缓！","五一调休","2021-04-23","1530",,"929.76","223.89"
"1531","1月24日，#2020王者荣耀冬冠# 年度颁奖典礼即将拉开帷幕！颁奖典礼不仅将为大家揭晓年度奖项，还有明星齐聚上演欢乐对决！#王者荣耀明星表演赛#","乔欣发怼脸视频否认整容","2021-05-19","1531","top40","1098.21","343.48"
"1532","游戏  ","薇娅龚俊直播","2021-04-01","1532","top40","955.67","298.95"
"1533","4月18日22时11分在台湾花莲县（北纬23.92度，东经121.53度）发生5.6级地震，震源深度7千米。","好长的一条李斯丹妮躺在地板上","2021-03-27","1533",,"1539.79","197.11"
"1534","河北隆尧谎报核酸检测结果涉事企业被暂停业务，业务代表翟某某已被刑拘。","上海昭通路居民区实施封闭管理","2021-01-21","1534","top40","1193.98","123.68"
"1535","教育  ","平均工资比个人实际到手工资要高","2021-05-19","1535","top40","1307.48","139.24"
"1536","周笔畅接受采访时被问会推荐哪位好友来参加《姐姐3》，笔笔表示“我就一位好友杨幂，然后你觉得呢？”","第二名的逆袭","2021-03-12","1536","top40","1018.3","174.75"
"1537","库里空砍39分，勇士加时不敌灰熊无缘季后赛，心疼库日天！","李沁樱花公主裙","2021-05-04","1537","top40","875.41","142.35"
"1538","5月22日，袁隆平院士的灵车开进湖南杂交水稻研究中心，不少市民自发前来送别，许多人围着灵车失声痛哭。","新疆小姐姐在HM门店外跳新疆舞","2021-03-27","1538","top40","924.92","229.37"
"1539","游戏  ","郑希怡喻言谢可寅孔雪儿打麻将","2021-01-15","1539",,"1840.82","205.93"
"1540","“看这盛世如我所愿，这盛世里，有你有我。你记得我，我就活着。”致敬英烈！","华晨宇 张碧晨","2021-01-21","1540","top40","1484.62","218.82"
"1541","青春有你3第二十期节目已上线，第三次排名已发布，一起来看看吧！","男子为躲酒场将检测报告改成阳性","2021-01-15","1541","top40","1442.03","289.81"
"1542","1月13日0时至19时，黑龙江省新增新冠肺炎确诊病例40例。","第二只被麻醉的金钱豹正在恢复","2021-05-08","1542",,"681.25","254.62"
"1543",,"何凯文","2021-01-19","1543","top40","1834.15","264.04"
"1544","无描述","林依轮薇娅李佳琦自拍","2021-04-28","1544","top40","826.95","342.12"
"1545","时尚博主gogoboi看到郑爽dy事件后，清空了所有关于女儿菲比的微博，网传其混血女儿疑似系dy所得，对此你们怎么看呢","坂本龙一确诊直肠癌","2021-01-21","1545","top40","985.6","335.9"
"1546","今年五一假期前，一系列涉及“文成广电工作群”男女二人的对话信息在网络上流传。其中，涉事男子被证实为浙江省温州市文成县应急管理局副局长赵青松。澎湃新闻注意到，文成县政府网站5月7日刊发的一则通知显示，文成县政府已于4月29日决定免去赵青松的文成县应急管理局副局长职务。","大学生抢不到票骑行200公里返校","2021-02-24","1546",,"1543.2","233.8"
"1547","军事  ","每次看到微信功能更新","2021-03-12","1547",,"1551.88","216.33"
"1548","那时候班婳的伙食…真的是挺丰盛的，现在想想都馋😋","段星星 生命不可承受之重","2021-03-01","1548","tip","908.01","283.58"
"1549","其他  ","第一视角滑全国最难雪道","2021-02-04","1549",,"610.22","310.03"
"1550","石家庄第二轮核酸检测检出阳性病例247例，石家庄检出阳性病例县市区8个，主要分布在藁城区；邢台第二轮核酸检测共检出18例阳性感染者，均来自邢台南宫市。","被老师性侵女生班主任发声","2021-01-21","1550","top40","996.46","343.74"
"1551","央视报道陕西洛南脱贫掺假，陕西回应：立即成立调查组对所报道问题进行全面深入调查，有关调查结果将及时公布。","刘浩存头脸好小","2021-02-11","1551","top40","858.91","362.43"
"1552","你们有什么试过跟父母沟通自己的婚姻观？他们的态度是怎么样的？带话题一起讨论下吧！","刘雯终止与彪马合作","2021-03-25","1552","top40","513.94","218.02"
"1553","当女孩子来例假～低情商：多喝热水 高情商：少喝冷水","河北疫情增长情况已得到明显遏制","2021-01-20","1553","top40","1777.13","183.96"
"1554","无描述","兰州一小区禁止特斯拉入内","2021-05-06","1554","top40","661.1","199.1"
"1555","继甘望星被学校通报没完成青年大学习后，现在自己说要补做了哈哈哈哈哈哈","为爱尖叫","2021-01-15","1555",,"714.12","289.31"
"1556","瘦下来并不是最终的目标，接下来好好吃认真练才是美好身材的开始，夏天来了，让我们一起变美吧！","默克尔承认塞尔维亚接种疫苗比德国快","2021-02-03","1556","top40","1438.44","296.87"
"1557","无描述","利路修 我不想限制自己的自由","2021-04-28","1557","top40","1663.36","271.86"
"1558","司藤直播，张彬彬看景甜的眼神太宠溺了！网友都说张彬彬是小猪佩奇！因为全程只有侧脸哈哈哈哈哈","8岁小朋友捡到3岁小朋友","2021-01-21","1558","top40","1590.56","318.14"
"1559",,"女明星约好了穿黄色礼服吗","2021-02-28","1559","top40","931","198.1"
"1560","2月4日，湖北武汉。江夏区法院审理一起酒驾致死案件。王某获邀与多个朋友吃饭，之后醉酒驾驶主人李某车辆，送李某、陈某离开，期间发生车祸致陈某死亡。王某对事故负主责，死者家属将11人起诉索赔。","古力娜扎 我爱家乡雪白的棉花","2021-03-25","1560","top40","993.09","181.01"
"1561","芒果TV《婆婆和妈妈2》茶话会杜淳爆料曾被老婆王灿拉黑过25次以上...","王牌对王牌","2021-01-29","1561",,"1268.61","174.11"
"1562","当地时间18日凌晨，应美方邀请，中方代表团成员抵达美国安克雷奇并下榻当地酒店，中美高层战略对话即将举行。","从小帅到大是什么体验","2021-04-12","1562","top40","1460.63","263.38"
"1563","1月13日0时至19时，黑龙江省新增新冠肺炎确诊病例40例。","中方不再承认所谓BNO护照为有效证件","2021-01-29","1563","top40","655.19","305.5"
"1564","明星  ","因防疫不力哈尔滨12名干部被追责问责","2021-01-31","1564","top40","619.57","269.77"
"1565","李易峰在春晚进行时的互动里一把搂过朱一龙的腰，这是免费能看的吗","被沈腾贾玲笑死","2021-01-29","1565",,"771.89","205.3"
"1566","吴青峰出庭与林暐哲著作权纠纷案，在庭后采访中他也哽咽回应一想到妈妈还得担心这些事情会觉得有点扛不住。","王牌对王牌火爆的后槽牙是华晨宇","2021-01-29","1566","top40","1687.68","223.91"
"1567","全国人大代表、编剧蒋胜男建议，取消国家公务员报考35岁以下的年龄限制。","教育部要求确保手机禁入课堂","2021-03-12","1567","top40","1799.68","267.84"
"1568","明星  ","关晓彤宋亚轩跳敏感","2021-01-29","1568","top40","1848.43","239.84"
"1569","特斯拉提供数据显示：事故前半小时刹车超40次，最后一次踩下制动踏板时，车辆时速为118.5km/h，碰撞前时速降至48.5km/h。","吕一好美","2021-04-16","1569",,"713.23","244.18"
"1570","中央文明办确定2021—2023年创建周期全国文明城市提名城市名单","雨中陵园浙江8岁男孩感动所有人","2021-04-03","1570","top40","1558.44","220.54"
"1571","这个经历实在太尴尬了！让小朋友直呼“叔叔你别拉了，我害怕”","不配","2021-05-13","1571","top40","1532.64","280.65"
"1572","无描述","哈尔滨呼兰区兰河街道升为高风险","2021-01-29","1572","top40","1053.68","232.25"
"1573","明星  ","朱一龙起诉造谣者","2021-05-14","1573","tip","1425.1","276.03"
"1574","朴灿烈在EXO官咖发布长文，向等待了很长时间的粉丝表达歉意。","成都一女生专职帮人写信","2021-01-21","1574","top40","674.33","330.22"
"1575","1月4日，山东省疾病预防控制中心完成对青岛报告的1例英国输入病例样本全基因测序分析，经比对，与近期高度关注的英国变异株序列高度同源。该病例为山东省第一例输入的新冠病毒VUI-202012/01突变体感染病例。","成年人的崩溃要不要藏起来","2021-01-14","1575","top40","1084.82","335.33"
"1576","明星-内地  ","福清猝死公交司机家属获赔123万","2021-01-29","1576","tip","1469.24","226.94"
"1577","奥斯卡评委夸易烊千玺：他的表演令人惊叹，你知道我的不会讲中文，我看的时候主要看表演和演技","崔天凯谈已关闭中美领事馆是否会重开","2021-03-27","1577","top40","677.13","305.89"
