"rank","artist","title","releaseYear","listHighestRank","listType","x","y"
"1044","文咏珊点赞了angelababy否认插足黄晓明李菲儿的文章，两人曾是亲密好友，后关系疏远。","西藏冒险王王相军系意外落水","2021-02-22","1044","top40","1129.76","331.16"
"1045","互联网  ","两高中女生遭同学杀害案将开庭","2021-05-17","1045","top40","439.96","241.29"
"1046",,"山东栖霞市委书记和市长被免职","2021-01-15","1046","top40","1147.41","186.33"
"1047","借精心雕琢的“强迫劳动”概念“以疆制华”，详戳↓↓","齐齐哈尔富拉尔基区居民一律居家不得外出","2021-01-19","1047","top40","1795.16","321.47"
"1048","无描述","龚俊举起手机反拍","2021-03-17","1048","top40","1043.18","127.4"
"1049","张靓颖表示赵英俊是吃完止疼药在家录的《送你一朵小红花》，那之后她每次聊天的结尾都发小红花的表情给英俊。","甘望星没完成青年大学习","2021-04-07","1049","top40","980.15","248.98"
"1050","王迅: 你这脖子上顶的是个啥黄子韬: 一张英俊潇洒的脸[哈哈]帅哥你说的对！","张碧晨发长文","2021-01-22","1050","top40","1424.78","313.42"
"1051","社会  ","那英粉丝应援海报都是金句","2021-01-19","1051","top40","1829.62","278.55"
"1052","中美举行高层战略对话，第一场会议上，国务委员兼外长王毅发言时美方代表在传纸条。看↓","618预售","2021-05-24","1052","tip","1262.58","282.22"
"1053","无描述","免洗手消毒液需20秒以上作用时间","2021-01-24","1053",,"1782.31","220.35"
"1054","无描述","老舍之子舒乙去世","2021-04-21","1054","top40","1355.25","263.73"
"1055","浙江省嘉善县公安局发布警情通报：3月13日，魏塘街道发生一起重大刑事案件，致5人死亡，1人受伤。","哇唧唧哇理智追星倡导书","2021-05-11","1055","top40","1129.31","127.73"
"1056","社会  ","杭州就地过年补贴已兑付6.66亿","2021-02-05","1056","top40","980.6","196.46"
"1057","杭州林女士（化名）在刷剧时发现电视剧的取景地竟是自己位于宁波、一直空置的别墅，随后将电视剧出品方、物业公司、播放平台等诉至法院，要求赔偿近300万元。日前，宁波慈溪市法院作出一审判决：判令两部电视剧的出品方赔偿林女士财产损失、房屋占有费等40余万元。","河北献县5名孩子坑塘中溺亡","2021-05-22","1057",,"902.73","271.35"
"1058","无描述","舒淇 终于没人管我没人要我管啦","2021-05-07","1058","top40","1133.75","224.87"
"1059","襄阳一位阿姨晒贾玲妈妈年轻时的照片，贾玲妈妈真好看呀～","红衣温客行 封神","2021-03-19","1059",,"803.05","339.21"
"1060","无描述","肖战冻得搓手","2021-01-15","1060","top40","1088.79","190.94"
"1061","半藏森林广告风波后发长文，称她任何举动都会掀起一场道德审判的盛宴，自己所承受的“私刑”已经越过了普世价值下的道德底线。","这不是杨紫是杜华","2021-04-21","1061","tip","1812.78","271.22"
"1062","自2021年1月17日起，将石家庄新乐市长寿街道调整为高风险地区。","时尚芭莎年度派对","2021-03-31","1062",,"686.61","273.48"
"1063","1998年，孙小果曾因强奸罪、故意伤害罪等多项罪名被判死刑，却只服刑12年零5个月就被释放。2020年2月20日，孙小果被执行死刑！","沈腾说乔杉比女演员的脸都小","2021-02-08","1063","tip","1507.37","217.27"
"1064","电商  ","央行5月20号发行心形纪念币","2021-05-06","1064","top40","1350.4","326.03"
"1065","社会  ","女孩拍婚纱照被羊怼","2021-01-17","1065","top40","1863.11","233.73"
"1066","张碧晨在猜歌环节猜的是《斗牛》，画画环节则是花了一朵花","缅甸民众敲锅碗瓢盆鸣笛向军方抗议","2021-02-03","1066","top40","1261.75","125.59"
"1067","无描述","王俊凯毕业大戏","2021-01-05","1067","top40","1791.94","337.17"
"1068","7日，Angelababy否认插足黄晓明和李菲儿后首现身，一身黑色亮片西装深V内搭，状态不错。她与蔡徐坤同台，画面养眼。","男生到底能有多自信","2021-01-25","1068","top40","1091.75","348.9"
"1069","“我男朋友马伯骞，我叫他大伯”，辣目洋子这是什么脑回路哈哈。","李钟硕","2021-01-20","1069","top40","1626.61","223.56"
"1070",,"被文咏珊惊艳到","2021-02-14","1070","top40","1155.39","188.47"
"1071","税务和广电管理部门将严查违法违规行为，坚决查处整治“阴阳合同”、“天价片酬”、偷逃税等问题。","皓嫣大婚","2021-05-03","1071","tip","1134.74","203.81"
"1072","关晓彤工作室发文否认视频假吃，并且晒出视频力证，表示是因为视频时长问题。","Amber晒与雪莉合照","2021-03-30","1072","tip","1901.21","320.1"
"1073","中国视协：依法纳税是宪法规定的每个公民的基本义务和爱国守法的道德义务。对于没有艺德的艺人，社会决不会为其提供发声露脸的机会。","狗狗币大涨","2021-04-16","1073","top40","960.17","261.95"
"1074","邢台市委常委、宣传部部长戎阳说，据隆尧县报告，因检测能力有限，收集样本委托济南某单位承担。14日，该公司向卫健部门谎报全部阴性。16日上午又报告有阳性样本。","建议9年义务教育延至12年","2021-03-10","1074","top40","1371.95","187.47"
"1075","张加丽女士在《希望的田野》成推荐会主持人，刚刚杨迪用实际行动支持丽丽子solo出道。","2021考研国家线","2021-03-12","1075","top40","856.18","370.88"
"1076","人民日报四问通化物资配送问题，回应如下：①目前通化市粮油菜肉蛋奶等基本生活物资储备充足，不存在短缺现象；②通化装配蔬菜包以成本价直送家中；③通化计划组织7000多人为封闭小区配送物资；④通化市民可携近期2次核酸结果阴性证明，报名当志愿者。","董洁","2021-01-22","1076",,"737.07","210.81"
"1077","社会  ","517","2021-05-17","1077","top40","1208.82","280.98"
"1078","无描述","余生请多指教","2021-02-28","1078","top40","1512.97","303.13"
"1079","哈尔滨呼兰公安通报社区志愿者被捅身亡，目前嫌犯已被刑事拘留","印度1岁儿童感染新冠死亡","2021-04-30","1079",,"1448.01","327.24"
"1080","网传一段关于“西藏冒险王20次降噪视频”引发热议。王相军的弟弟王龙称，网传视频是其哥哥王相军2020年12月10日拍摄的，相当于12月19日当天发的是此前拍摄的库存视频，哥哥是12月20日遇难的，时间节点对不上。“那个地方确实不可能是案发现场。”","詹姆斯谈科比去世一周年","2021-01-19","1080","top40","991.08","315.45"
"1081","音乐-华语音乐  ","李佳琦微博评论","2021-02-12","1081","top40","856.52","121.69"
"1082",,"张柏芝和儿子的相处方式","2021-05-05","1082","tip","654.36","270.48"
"1083","BCI上海办事处一名员工回应，BCI中国团队没有在新疆发现强迫劳动，品牌行为与其无关，今日将发表最新声明。","王源都长大了月亮姐姐还没老","2021-02-12","1083","top40","733.25","257.89"
"1084","近日，《快乐大本营》导演甘亿在采访中回应“快本现在谁红谁上，以前谁上谁红”的争议，称根本原因在于现在网络的曝光力量是最强大的。","印度疫苗接种现重大失误","2021-02-02","1084","top40","1230.5","220.35"
"1085","路透社今日消息，加拿大一家法院13日庭审时曝出，华为首席财务官孟晚舟在温哥华居家期间，曾数次收到死亡威胁，其中包括装有子弹的信件。","李菲儿皇冠掉了","2021-04-16","1085",,"1017.47","374.5"
"1086","华晨宇、关晓彤合作演绎《我的少女时代——十年之约》。","杨丞琳被罗一舟唐九洲友情感动哭","2021-04-23","1086","top40","717.96","323.4"
"1087","明星-内地  ","秦朝","2021-01-19","1087","top40","814.38","247.12"
"1088","港媒报道称吴孟达今日病情情况转危，已经转入ICU治疗，医生通知家人到医院来看他，好友田启文也赶去了医院。","孙艺珍生日蛋糕图是爱的迫降","2021-01-14","1088","top40","935.37","294.88"
"1089","一名与华盛顿关系密切的工党高级官员爆料，梅根利用奥普拉采访风波来开启她的政治生涯，并正在与美国民主党高层建立联系并成立竞选与筹款团队。","春晚小品","2021-02-11","1089","top40","1912.71","302.73"
"1090","社会  ","向佐药水哥对决","2021-05-15","1090",,"1604.41","276.98"
"1091","2月2日，女演员高溜微博发长文，讲述了自己做医美鼻子整形失败的不幸遭遇。","能不能让梁博多唱两句","2021-04-16","1091","top40","1612.75","199.08"
"1092","有网友称在陈赫火锅店就餐时被掉落的天花板砸伤，陈赫转发火锅店声明道歉，“再次向两位顾客深表歉意，全面排查整改，安全问题绝不姑息！” ​","4AM吃鸡","2021-05-22","1092",,"593.56","230.12"
"1093","无描述","当男朋友暗示我给他买礼物","2021-04-16","1093","top40","1101.42","238.02"
"1094","《我就是演员》宋妍霏说自己一年多没接到戏了，曾被说长得太有攻击性了。","顺丰公开暴力分拣识别方法相关专利","2021-01-20","1094","top40","1488.89","314.49"
"1095","微信今日更新8.0版本，新表情来了，常用的黄脸表情包比如裂开、让我看看等都可以动起来了。微信方面表示正在灰度测试新表情中，看看你的黄脸表情会动了吗？","李在镕获刑2年半","2021-01-18","1095",,"804.39","124.35"
"1096","4月17日，@郑恺 在生日会上透露不出意外的话，今年将和@苗苗-vivi 办婚礼。","吴宇恒帅得好干净","2021-04-24","1096","top40","1767.55","341.16"
"1097","唐嫣在《王牌对王牌》中再次扮演紫萱，回忆满满呀！！","真以为人家只是写小说 这叫写日记","2021-05-26","1097","tip","1743.34","323.43"
"1098",,"赘婿","2021-03-02","1098",,"760.03","176.04"
"1099","上海迪士尼噗噗熊被打🐻小孩冲过来打，事后家长态度也十分强硬！","宁静 何炅有一颗很帅的脖子","2021-04-24","1099","top40","1815.06","332.86"
"1100","今年春节档黑马《你好，李焕英》，票房正蹭蹭往上涨，目前总票房已破36.51亿，超越《红海行动》的36.5095亿票房，目前位列中国影史票房第六名。","熟蛋返生论文校长辞职","2021-04-28","1100","top40","1300.92","238.06"
"1101","追光吧哥哥中杜淳的最新顶胯舞，你们看完后是什么反应？？","长歌行","2021-04-06","1101","top40","974.24","243.57"
"1102","#80后90后的压力有多大#有人问我，如果看待有些80后90后不生小孩子呀，是不喜欢吗？","江一燕","2021-03-17","1102","top40","884.76","231.59"
"1103","明星-内地  ","沈阳全员核酸检测发现命案逃犯","2021-01-16","1103",,"1485.85","297.77"
"1104","其他  ","医保卡可以全家使用消息不实","2021-04-16","1104","top40","1617.38","227.97"
"1105","无描述","90后女孩辞职拍摄菌类","2021-02-13","1105",,"950.99","175.91"
"1106","R1SE成员任豪发文谈日本福岛核废水引争议，他删博后再发文回应，“如果你的冷嘲热讽能唤起大家的重视，那我觉得骂骂我也还挺开心的”。","驻缅甸大使馆紧急提醒在缅中国公民","2021-02-01","1106","top40","1452.21","259.93"
"1107","1月14日0—24时,河北新增90例本土确诊病例。","印度一新郎新冠阳性仍举行婚礼","2021-04-28","1107","top40","1482.4","226.56"
"1108","货拉拉女乘客身亡，事发半个月后，22日，长沙警方对事发现场进行重新勘查。法医刘良认为，女孩跳窗的可能性不大。","泫雅金晓钟算命结果","2021-03-02","1108","top40","939.73","237.91"
"1109","薛之谦发长文悼念赵英俊：“16年前，不管从外观还是口音，我想我们都不会是朋友。16年后，我最难过的事，竟然是送走了你。……再见了哥，希望不久就会下雨……” ​","郭美美被批捕","2021-04-16","1109",,"1344.64","199.73"
"1110","据多位业内人士消息，原乐视影业CEO及执行董事张昭去世，终年58岁。","三星堆是外星文明吗","2021-03-20","1110","top40","1307.35","305.98"
"1111","电视剧  ","任嘉伦工作室辟谣网传新剧","2021-04-28","1111","top40","796.22","333.39"
"1112","综艺  ","郎朗吉娜庆祝儿子百天","2021-05-07","1112","top40","1171.71","239.76"
"1113","乐华娱乐发布声明，对网传王一博约会开红跑车的网红等言论进行辟谣，称相关言论皆为不实，已委托律所进行取证，将严肃追责。 ​","山河令","2021-04-16","1113","top40","843.58","303.64"
"1114","无描述","公交公司回应女生被夹遭拖行","2021-04-11","1114","top40","927.5","112.95"
"1115","据@企查查 ，阿迪达斯体育（中国）有限公司于4月23日新增行政处罚，处罚机关为苏州工业园区市场监督管理局，处罚事由为违反广告内容管理规定行为及其从属。","大多数主播月收入3000至5000元","2021-05-18","1115",,"1072.53","324.79"
"1116","近日，江苏邳州的宋某向法院起诉，要求撤销婚姻。此前，宋某和妻子办理结婚登记手续后，才得知妻子患有偏执型精神分裂症，且有家族病史。","疫苗接种方舱来了","2021-04-14","1116","top40","725.28","365.38"
"1117","明星  ","张子枫梁靖康吻戏","2021-03-24","1117","top40","1218.21","155.45"
"1118","26日，邓超、陈赫、鹿晗在微博晒出三人合照，邓超、鹿晗调侃陈赫的脚全世界最丑。","肖战对李宇春说的话","2021-04-16","1118",,"907.16","222.18"
"1119","明星-内地  ","考研学生被高校预录取后退回","2021-04-16","1119","top40","1392.02","249.42"
"1120","张震为《缉魂》减重25斤，超标完成导演期待。“这种极致的减肥，痛苦是一定很痛苦的。”","苏炳添百米9秒98","2021-04-24","1120","top40","1049.42","278.9"
"1121","沈月微博直播太好玩了，和刘以豪闫桉代云帆连麦，居然都插不上嘴，听三个男生讲发色哈哈哈","付国豪离职","2021-04-22","1121","top40","693.17","281.44"
"1122","无描述","张文宏说年轻人打疫苗是为国家做贡献","2021-03-10","1122","top40","1101.09","372.69"
"1123","无描述","冷门歌手孙燕姿","2021-04-28","1123","tip","1014.24","209.37"
"1124","综艺-内地综艺  ","黄晓明微博评论","2021-02-17","1124","top40","635.73","237.66"
"1125",,"世卫敦促英国暂停疫苗接种计划","2021-01-31","1125","top40","1132.49","181.92"
"1126","财经  ","张若昀正式起诉父亲张健","2021-04-28","1126","top40","923.05","134.57"
"1127","工作室否认网传黄晓明逛夜店并有美女陪同，称2月4日起黄晓明已进组拍摄，大年三十回老家初一即刻返工，不存在现身夜店。","张彬彬 明天不更新可以吗","2021-04-03","1127","top40","1675.93","261.4"
"1128","全国人大代表李甦雁建议，创新教育评价机制，把包括视力状况在内的学生体质健康状况纳入衡量学生综合素质的标准，作为评价地方和学校工作的重要依据，“切莫牺牲孩子的视力来换取高分数和好成绩”。","官方回应大连一女子不配合防疫登记","2021-01-15","1128","top40","1896.57","251.88"
"1129","明星  ","多所高校开设死亡教育课","2021-04-02","1129","top40","1458.03","277.55"
"1130","5月22日，突如其来的恶劣天气让五名越野赛选手汇集一起。此时，景泰县常生村村民朱克铭正在窑洞避雨。朱克铭把大伙带到窑洞，又生起了几堆火。随后他跑到有信号的地方，拨打了景区的救援热线。张望救援队时，朱克铭又救起一名已经失温倒地的选手。","张国立节目感觉在看国家宝藏","2021-02-12","1130","tip","1875.52","301.26"
"1131","@微博综艺 推荐：由特仑苏冠名的向往的生活每周五22:00，我们在一起就是向往的生活！","这是利路修最开心的舞台吧","2021-04-24","1131","top40","1590.69","277.57"
"1132","综艺  ","王者荣耀芈月新皮肤","2021-01-25","1132","top40","1273.1","167.2"
"1133","明星  ","快乐大本营","2021-03-27","1133","top40","832.04","325.11"
"1134","全国政协常委、中国科学院院士袁亚湘表示，不建议普通孩子学奥数，奥数只是极少数孩子去学的，不适合大范围学习。","张哲瀚全开麦","2021-05-03","1134","top40","1670.74","230.09"
"1135","明星  ","身份证是如何制作出来的","2021-01-08","1135","top40","1416.17","312.21"
"1136","3月1日起，将全面执行2020年国家医保药品目录，其中，七种罕见病治疗药物纳入医保目录。","饿了么","2021-02-01","1136","top40","697.08","323.16"
"1137","国家邮政局统计显示，除夕和初一两天，全国快递处理超过1.3亿件，同比增长223%。快递不打烊，春节也能买买买。给春节坚守岗位的快递小哥道一声，辛苦了！ ​","杨幂迪丽热巴终止与阿迪达斯合作","2021-03-25","1137","top40","1875.54","234.66"
"1138","当地时间13日晚11时许，日本福岛附近海域发生里氏7.1级地震。东京等地有明显震感。","央视曝光千元神药大盐湖水骗局","2021-05-06","1138",,"1715.33","185.01"
"1139","宁静表示她这种盲目的从团可能会给大家带来压力，抛开她姐姐们可以非常自如地去演出。","中共中央国务院举行春节团拜会","2021-02-10","1139","top40","953.82","184.08"
"1140",,"GAI经纪公司声明","2021-05-07","1140","top40","1106.98","270.76"
"1141","多多晒出一张照片，配文说：“我现在终于知道我和妈妈长得有多像了，因为我用我的脸打开了妈妈的手机”。","返乡人员指从外地返回农村地区人员","2021-01-21","1141",,"1180.79","237"
"1142",,"石家庄全市核酸检测","2021-01-05","1142",,"1148.26","268.71"
"1143","《婆婆和妈妈2》陈松伶与婆婆谈起孩子，表示自己因为身体原因放弃生育，婆婆回答豁达又暖心。","二建考试","2021-05-22","1143",,"1919.94","295.9"
"1144","今年，很多人的年夜饭发生了变化。记者在云南的一些商超走访时发现，这些店铺推出了供单人和双人选择的小份制年夜饭豪华套餐，让就地过年也能过出仪式感和满足感。","流金岁月","2021-01-14","1144","top40","1834.07","252.67"
"1145",,"21世纪第21年的第21天","2021-01-21","1145","top40","1752.41","204.56"
"1146","中国地震台网正式测定：05月21日21时21分在云南大理州漾濞县（北纬25.63度，东经99.92度）发生6.4级地震，震源深度10千米。","那英 成团出道我是认真的","2021-04-13","1146","top40","902.92","213.68"
"1147","当地时间周六（16日），成千上万的民众涌上奥地利首都维也纳的街头，抗议政府为遏制新冠疫情而实施的封锁限制。在游行现场，大多数民众都没有佩戴口罩，甚至还在相互亲吻和拥抱。","广州疫情","2021-05-28","1147","top40","1085.95","355.58"
"1148","无描述","终于等到周杰伦","2021-02-12","1148","top40","1412.33","217.94"
"1149","黑龙江、河北聚集性疫情还未结束，吉林出现了“1传19”的超级传播事件——1名黑龙江省输入无症状感染者，已导致吉林省3市19人感染，分布在通化市（12例）、公主岭市（6例）、松原市（1例）。","马鹤琪","2021-02-10","1149","top40","1095.27","160.26"
"1150","#肖战贾玲拥抱# 微博之夜内场，肖战贾玲拥抱真好！","蜜雪冰城道歉","2021-05-15","1150","top40","761.89","203.04"
"1151","2020微博之夜李现和迪丽热巴获“微博年度魅力价值人物”荣誉，上台时走出了要去干架的气场哈哈哈！","辣目洋子贾冰小品好笑","2021-02-10","1151","top40","1316.8","231.23"
"1152","近日，沈阳市公安局皇姑分局辽河派出所组织辖区“盛京义勇”平安志愿者对尚未参加第三轮全员核酸检测的居民进行排查时，发现一名男子拒不提供个人身份信息，形迹十分可疑。经民警审讯发现，这名男子21年前因琐事将同学杀害并埋尸，涉嫌故意杀人罪被吉林警方立为网上逃犯，他也对犯罪事实供认不讳。","虞书欣魔术穿帮","2021-02-10","1152","tip","1647.89","236.62"
"1153",,"河北5天新增234例感染者","2021-01-07","1153","top40","1609.5","292.75"
"1154","互联网  ","孟子义情商","2021-05-30","1154","top40","1446.29","253.59"
"1155","看到黄晓明瘦了，尹正流下羡慕的泪水哈哈哈哈哈哈哈啊哈哈","龚俊唐艺昕曾舜晞把未来点亮","2021-05-04","1155","top40","1263.38","330.91"
"1156","近日，上海海关所属邮局海关工作人员在进行X光机查验时，发现一个申报品名为“牙科耗材”的海外进境邮件包裹影像异常。","六安百万人口核酸检测结果出来了","2021-05-17","1156","top40","1138.77","233.84"
"1157","马思纯白敬亭车内吻花絮，白敬亭亲到马思纯鼻子上了，看来不经常拍吻戏，很不熟练呀！","周柯宇把羽毛给奥斯卡了","2021-04-24","1157","top40","1403.26","217.45"
"1158","湖南长沙，袁花花是袁隆平院士在2020年五一收养的小猫，袁老对它爱不释手。杂交水稻研究中心研究员辛业芸称，袁花花经常陪着袁老听工作汇报，曾在试验田里捉过青蛙老鼠。袁老回来时，小猫跑着去迎接，要躺在离袁老最近的地方。","看李焕英把口罩哭湿","2021-02-13","1158","top40","1578.7","200.56"
"1159","知情人士透露称，韩星咸素媛与小其18岁的中国籍老公陈华最近关系急速恶化，因此选择了分手。","北京一确诊隐瞒行程拒不配合流调","2021-01-11","1159","tip","1553.38","226.6"
"1160","王子文在《听姐说》的录制现场收到了粉丝送给她的信，不过她好像不知道自己就叫小丸这个谐音梗哈哈哈哈，好可爱～","离职了你会和领导说什么","2021-05-12","1160","tip","419.48","250.83"
"1161","2021年4月22日9时，太原市中级人民法院在本院17号法庭对原告仝卓诉被告山西省招生考试管理中心作出的《国家教育考试考生违规处理决定书》一案公开开庭进行审理。原被告代理人及行政机关负责人参加了庭审，双方充分发表诉辩意见，对证据进行举证质证，案件将择日宣判。 ​","创造营排名","2021-04-17","1161",,"843.75","257.93"
"1162","今晚，郎朗吉娜微博官宣得子喜讯，恭喜他们有小宝宝啦！","陈思诚映后首谈唐探3","2021-02-20","1162","top40","1316.54","298.47"
"1163","电视剧-国产剧  ","春节前后疫情防控情况","2021-01-20","1163","top40","746.84","145.84"
"1164","无描述","吴尊和同学合照像两辈人","2021-02-07","1164","top40","1167.5","279.96"
"1165","近日，一名网友在网络发布信息，其中提到该网友于5月9日接到成都第四十九中学校发来的信息，表示其孩子因从楼道坠落身亡，但学校拒绝家长进入学校并不提供监控等信息，引起高度关注。","袁隆平的禾下乘凉梦","2021-05-22","1165","top40","565.64","247.1"
"1166","明星  ","8400亿人民币是什么概念","2021-05-04","1166","top40","896.42","198.79"
"1167","无描述","新冠疫苗不得强制要求全员接种","2021-04-11","1167","top40","916.49","314.51"
"1168","读书  ","张哲瀚状态","2021-05-21","1168","top40","1229.17","296"
"1169","国家卫健委疾控局监察专员王斌：返乡人员需持有7日以内核酸检测阴性证明才能够返乡。","热巴 拍900张照片简单选出19张难","2021-02-28","1169","top40","981.26","358.9"
"1170","江苏常州，大二学生小巢假期里不停地聚餐，几天后感觉严重腹痛。经检查，小巢患上急性胰腺炎。","仅1个月巴西近6.7万人死于新冠","2021-04-02","1170","top40","950.76","349.05"
"1171","本次疫情有24例感染者是经过4次以上核酸筛查被发现。有的病例潜伏期超过10天，故本次疫情持续时间较长。","上海牺牲消防员一个32岁一个25岁","2021-04-25","1171",,"1848.83","302.18"
"1172","30日，上海新冠肺炎医疗救治专家组组长张文宏称就地过年是作出了牺牲，“没有谁认为这些做法是理所当然的”，可以“看作是为全中国人民所作的一次贡献和慈善”，祝大家春节开心，家人平安。","卫健局回应急救伤者从担架摔落","2021-03-16","1172","top40","1343.05","253.05"
"1173","台湾4月30日新增3例本地新冠肺炎确诊病例，皆为华航机组人员检疫居住的防疫旅馆“台北诺富特华航桃园机场饭店”员工。","工信部22条规定保护个人信息","2021-02-05","1173","top40","1081.18","187.02"
"1174","《理想照耀中国》之《希望的田野》赵丽颖演畲族女孩雷金玉，放弃繁荣生活，投身家乡建设，带领乡亲们脱贫致富。","民警牺牲数月女儿还在发微信找爸爸","2021-04-04","1174",,"1604.42","268.29"
"1175","姚安娜现身上海车展，来看看她的现场生图状态怎么样？","央行严肃整治拒收人民币现金行为","2021-01-21","1175","top40","1638.04","188.02"
"1176","无描述","辽宁营口辟谣已找到零号病人","2021-05-19","1176","top40","923.17","308.96"
